"id","code","name","small_name","description","type","parent_id:id","internal_type","id_dest"
"cfop_6116","6116","Venda de produção do estabelecimento originada de encomenda para entrega futura","Venda de produção do estabelecimento originada de encomenda ","Classificam-se neste código as vendas de produtos industrializados ou produzido pelo próprio estabelecimento, quando da saída real do produto, cujo faturamento tenha sido classificado no código 6.922  Lançamento efetuado a título de simples faturamento decorrente de venda para entrega futura.","output","cfop_6100","normal",2
"cfop_6117","6117","Venda de mercadoria adquirida ou recebida de terceiros, originada de encomenda para entrega futura","Venda de mercadoria adquirida ou recebida de terceiros, orig","Classificam-se neste código as vendas de mercadorias adquiridas ou recebidas de terceiros, que não tenham sido objeto de qualquer processo industrial no estabelecimento, quando da saída real da mercadoria, cujo faturamento tenha sido classificado no código 6.922 - Lançamento efetuado a título de simples faturamento decorrente de venda para entrega futura.","output","cfop_6100","normal",2
"cfop_6118","6118","Venda de produção do estabelecimento entregue ao destinatário por conta e ordem do adquirente originário, em venda à ordem","Venda de produção do estabelecimento entregue ao destinatári","Classificam-se neste código as vendas à ordem de produtos industrializados pelo estabelecimento, entregues ao destinatário por conta e ordem do adquirente originário.","output","cfop_6100","normal",2
"cfop_6119","6119","Venda de mercadoria adquirida ou recebida de terceiros entregue ao destinatário por conta e ordem do adquirente originário, em venda à ordem","Venda de mercadoria adquirida ou recebida de terceiros entre","Classificam-se neste código as vendas à ordem de mercadorias adquiridas ou recebidas de terceiros, que não tenham sido objeto de qualquer processo industrial no estabelecimento, entregues ao destinatário por conta e ordem do adquirente originário.","output","cfop_6100","normal",2
"cfop_6120","6120","Venda de mercadoria adquirida ou recebida de terceiros entregue ao destinatário pelo vendedor remetente, em venda à ordem","Venda de mercadoria adquirida ou recebida de terceiros entre","Classificam-se neste código as vendas à ordem de mercadorias adquiridas ou recebidas de terceiros, que não tenham sido objeto de qualquer processo industrial no estabelecimento, entregues pelo vendedor remetente ao destinatário, cuja compra seja classificada, pelo adquirente originário, no código 2.118 - Compra de mercadoria pelo adquirente originário, entregue pelo vendedor remetente ao destinatário, em venda à ordem.","output","cfop_6100","normal",2
"cfop_6122","6122","Venda de produção do estabelecimento remetida para industrialização, por conta e ordem do adquirente, sem transitar pelo estabelecimento do adquirente","Venda de produção do estabelecimento remetida para industria","Classificam-se neste código as vendas de produtos industrializados no estabelecimento, remetidos para serem industrializados em outro estabelecimento, por conta e ordem do adquirente, sem que os produtos tenham transitado pelo estabelecimento do adquirente.","output","cfop_6100","normal",2
"cfop_6123","6123","Venda de mercadoria adquirida ou recebida de terceiros remetida para industrialização, por conta e ordem do adquirente, sem transitar pelo estabelecimento do adquirente","Venda de mercadoria adquirida ou recebida de terceiros remet","Classificam-se neste código as vendas de mercadorias adquiridas ou recebidas de terceiros, que não tenham sido objeto de qualquer processo industrial no estabelecimento, remetidas para serem industrializadas em outro estabelecimento, por conta e ordem do adquirente, sem que as mercadorias tenham transitado pelo estabelecimento do adquirente.","output","cfop_6100","normal",2
"cfop_6124","6124","Industrialização efetuada para outra empresa","Industrialização efetuada para outra empresa","Classificam-se neste código as saídas de mercadorias industrializadas para terceiros, compreendendo os valores referentes aos serviços prestados e os das mercadorias de propriedade do industrializador empregadas no processo industrial.","output","cfop_6100","normal",2
"cfop_6125","6125","Industrialização efetuada para outra empresa quando a mercadoria recebida para utilização no processo de industrialização não transitar pelo estabelecimento adquirente da mercadoria","Industrialização efetuada para outra empresa quando a mercad","Classificam-se neste código as saídas de mercadorias industrializadas para outras empresas, em que as mercadorias recebidas para utilização no processo de industrialização não tenham transitado pelo estabelecimento do adquirente das mercadorias, compreendendo os valores referentes aos serviços prestados e os das mercadorias de propriedade do industrializador empregadas no processo industrial.","output","cfop_6100","normal",2
"cfop_6129","6129","Venda de insumo importado e de mercadoria industrializada sob o amparo do Regime Aduaneiro especial de Entreposto Industrial (Recof-Sped)","Venda de insumo importado (Recof-Sped)","Classificam-se neste código as vendas de insumo importado e de mercadoria industrializada sob o amparo do Regime Aduaneiro especial de Entreposto Industrial (Recof-Sped).","output","cfop_6100","normal",2
"cfop_6150","6150","TRANSFERÊNCIAS DE PRODUÇÃO PRÓPRIA OU DE TERCEIROS","TRANSFERÊNCIAS DE PRODUÇÃO PRÓPRIA OU DE TERCEIROS",,"output","cfop_6000","view",2
"cfop_6151","6151","Transferência de produção do estabelecimento","Transferência de produção do estabelecimento","Classificam-se neste código os produtos industrializados ou produzidos pelo estabelecimento em transferência para outro estabelecimento da mesma empresa.","output","cfop_6150","normal",2
"cfop_6152","6152","Transferência de mercadoria adquirida ou recebida de terceiros","Transferência de mercadoria adquirida ou recebida de terceir","Classificam-se neste código as mercadorias adquiridas ou recebidas de terceiros para industrialização, comercialização ou para utilização na prestação de serviços e que não tenham sido objeto de qualquer processo industrial no estabelecimento, transferidas para outro estabelecimento da mesma empresa.","output","cfop_6150","normal",2
"cfop_6153","6153","Transferência de energia elétrica","Transferência de energia elétrica","Classificam-se neste código as transferências de energia elétrica para outro estabelecimento da mesma empresa, para distribuição.","output","cfop_6150","normal",2
"cfop_6155","6155","Transferência de produção do estabelecimento, que não deva por ele transitar","Transferência de produção do estabelecimento, que não deva p","Classificam-se neste código as transferências para outro estabelecimento da mesma empresa, de produtos industrializados no estabelecimento que tenham sido remetidos para armazém geral, depósito fechado ou outro, sem que haja retorno ao estabelecimento depositante.","output","cfop_6150","normal",2
"cfop_6156","6156","Transferência de mercadoria adquirida ou recebida de terceiros, que não deva por ele transitar","Transferência de mercadoria adquirida ou recebida de terceir","Classificam-se neste código as transferências para outro estabelecimento da mesma empresa, de mercadorias adquiridas ou recebidas de terceiros para industrialização ou comercialização, que não tenham sido objeto de qualquer processo industrial, remetidas para armazém geral, depósito fechado ou outro, sem que haja retorno ao estabelecimento depositante.","output","cfop_6150","normal",2
"cfop_6200","6200","DEVOLUÇÕES DE COMPRAS PARA INDUSTRIALIZAÇÃO, PRODUÇÃO RURAL, COMERCIALIZAÇÃO OU ANULAÇÕES DE VALORES","DEVOLUÇÕES DE COMPRAS PARA INDUSTRIALIZAÇÃO, PRODUÇÃO RURAL,",,"output","cfop_6000","view",2
"cfop_6201","6201","Devolução de compra para industrialização ou produção rural","Devolução de compra para industrialização ou produção rural","Classificam-se neste código as devoluções de mercadorias adquiridas para serem utilizadas em processo de industrialização ou produção rural, cujas entradas tenham sido classificadas como 2.201 - Compra para industrialização ou produção rural.","output","cfop_6200","normal",2
"cfop_6202","6202","Devolução de compra para comercialização","Devolução de compra para comercialização","Classificam-se neste código as devoluções de mercadorias adquiridas para serem comercializadas, cujas entradas tenham sido classificadas como Compra para comercialização.","output","cfop_6200","normal",2
"cfop_6205","6205","Anulação de valor relativo a aquisição de serviço de comunicação","Anulação de valor relativo a aquisição de serviço de comunic","Classificam-se neste código as anulações correspondentes a valores faturados indevidamente, decorrentes das aquisições de serviços de comunicação.","output","cfop_6200","normal",2
"cfop_6206","6206","Anulação de valor relativo a aquisição de serviço de transporte","Anulação de valor relativo a aquisição de serviço de transpo","Classificam-se neste código as anulações correspondentes a valores faturados indevidamente, decorrentes das aquisições de serviços de transporte.","output","cfop_6200","normal",2
"cfop_6207","6207","Anulação de valor relativo à compra de energia elétrica","Anulação de valor relativo à compra de energia elétrica","Classificam-se neste código as anulações correspondentes a valores faturados indevidamente, decorrentes da compra de energia elétrica.","output","cfop_6200","normal",2
"cfop_6208","6208","Devolução de mercadoria recebida em transferência para industrialização ou produção rural","Devolução de mercadoria recebida em transferência para indus","Classificam-se neste código as devoluções de mercadorias recebidas em transferência de outros estabelecimentos da mesma empresa, para serem utilizadas em processo de industrialização ou produção rural.","output","cfop_6200","normal",2
"cfop_6209","6209","Devolução de mercadoria recebida em transferência para comercialização","Devolução de mercadoria recebida em transferência para comer","Classificam-se neste código as devoluções de mercadorias recebidas em transferência de outro estabelecimento da mesma empresa, para serem comercializadas.","output","cfop_6200","normal",2
"cfop_6210","6210","Devolução de compra para utilização na prestação de serviço","Devolução de compra para utilização na prestação de serviço","Classificam-se neste código as devoluções de mercadorias adquiridas para utilização na prestação de serviços, cujas entradas tenham sido classificadas no código 2.126 - Compra para utilização na prestação de serviço.","output","cfop_6200","normal",2
"cfop_6250","6250","VENDAS DE ENERGIA ELÉTRICA","VENDAS DE ENERGIA ELÉTRICA",,"output","cfop_6000","view",2
"cfop_6251","6251","Venda de energia elétrica para distribuição ou comercialização","Venda de energia elétrica para distribuição ou comercializaç","Classificam-se neste código as vendas de energia elétrica destinada à distribuição ou comercialização. Também serão classificadas neste código as vendas de energia elétrica destinada a cooperativas para distribuição aos seus cooperados.","output","cfop_6250","normal",2
"cfop_6252","6252","Venda de energia elétrica para estabelecimento industrial","Venda de energia elétrica para estabelecimento industrial","Classificam-se neste código as vendas de energia elétrica para consumo por estabelecimento industrial. Também serão classificadas neste código as vendas de energia elétrica destinada a estabelecimento industrial de cooperativa.","output","cfop_6250","normal",2
"cfop_6253","6253","Venda de energia elétrica para estabelecimento comercial","Venda de energia elétrica para estabelecimento comercial","Classificam-se neste código as vendas de energia elétrica para consumo por estabelecimento comercial. Também serão classificadas neste código as vendas de energia elétrica destinada a estabelecimento comercial de cooperativa.","output","cfop_6250","normal",2
"cfop_6254","6254","Venda de energia elétrica para estabelecimento prestador de serviço de transporte","Venda de energia elétrica para estabelecimento prestador de ","Classificam-se neste código as vendas de energia elétrica para consumo por estabelecimento de prestador de serviços de transporte.","output","cfop_6250","normal",2
"cfop_6255","6255","Venda de energia elétrica para estabelecimento prestador de serviço de comunicação","Venda de energia elétrica para estabelecimento prestador de ","Classificam-se neste código as vendas de energia elétrica para consumo por estabelecimento de prestador de serviços de comunicação.","output","cfop_6250","normal",2
"cfop_6256","6256","Venda de energia elétrica para estabelecimento de produtor rural","Venda de energia elétrica para estabelecimento de produtor r","Classificam-se neste código as vendas de energia elétrica para consumo por estabelecimento de produtor rural.","output","cfop_6250","normal",2
"cfop_6257","6257","Venda de energia elétrica para consumo por demanda contratada","Venda de energia elétrica para consumo por demanda contratad","Classificam-se neste código as vendas de energia elétrica para consumo por demanda contratada, que prevalecerá sobre os demais códigos deste subgrupo.","output","cfop_6250","normal",2
"cfop_6258","6258","Venda de energia elétrica a não contribuinte","Venda de energia elétrica a não contribuinte","Classificam-se neste código as vendas de energia elétrica a pessoas físicas ou a pessoas jurídicas não indicadas nos códigos anteriores.","output","cfop_6250","normal",2
"cfop_6300","6300","PRESTAÇÕES DE SERVIÇOS DE COMUNICAÇÃO","PRESTAÇÕES DE SERVIÇOS DE COMUNICAÇÃO",,"output","cfop_6000","view",2
"cfop_6301","6301","Prestação de serviço de comunicação para execução de serviço da mesma natureza","Prestação de serviço de comunicação para execução de serviço","Classificam-se neste código as prestações de serviços de comunicação destinados às prestações de serviços da mesma natureza.","output","cfop_6300","normal",2
"cfop_6302","6302","Prestação de serviço de comunicação a estabelecimento industrial","Prestação de serviço de comunicação a estabelecimento indust","Classificam-se neste código as prestações de serviços de comunicação a estabelecimento industrial. Também serão classificados neste código os serviços de comunicação prestados a estabelecimento industrial de cooperativa.","output","cfop_6300","normal",2
"cfop_6303","6303","Prestação de serviço de comunicação a estabelecimento comercial","Prestação de serviço de comunicação a estabelecimento comerc","Classificam-se neste código as prestações de serviços de comunicação a estabelecimento comercial. Também serão classificados neste código os serviços de comunicação prestados a estabelecimento comercial de cooperativa.","output","cfop_6300","normal",2
"cfop_6304","6304","Prestação de serviço de comunicação a estabelecimento de prestador de serviço de transporte","Prestação de serviço de comunicação a estabelecimento de pre","Classificam-se neste código as prestações de serviços de comunicação a estabelecimento prestador de serviço de transporte.","output","cfop_6300","normal",2
"cfop_6305","6305","Prestação de serviço de comunicação a estabelecimento de geradora ou de distribuidora de energia elétrica","Prestação de serviço de comunicação a estabelecimento de ger","Classificam-se neste código as prestações de serviços de comunicação a estabelecimento de geradora ou de distribuidora de energia elétrica.","output","cfop_6300","normal",2
"cfop_6306","6306","Prestação de serviço de comunicação a estabelecimento de produtor rural","Prestação de serviço de comunicação a estabelecimento de pro","Classificam-se neste código as prestações de serviços de comunicação a estabelecimento de produtor rural.","output","cfop_6300","normal",2
"cfop_6307","6307","Prestação de serviço de comunicação a não contribuinte","Prestação de serviço de comunicação a não contribuinte","Classificam-se neste código as prestações de serviços de comunicação a pessoas físicas ou a pessoas jurídicas não indicadas nos códigos anteriores.","output","cfop_6300","normal",2
"cfop_6350","6350","PRESTAÇÕES DE SERVIÇOS DE TRANSPORTE","PRESTAÇÕES DE SERVIÇOS DE TRANSPORTE",,"output","cfop_6000","view",2
"cfop_6351","6351","Prestação de serviço de transporte para execução de serviço da mesma natureza","Prestação de serviço de transporte para execução de serviço ","Classificam-se neste código as prestações de serviços de transporte destinados às prestações de serviços da mesma natureza.","output","cfop_6350","normal",2
"cfop_6352","6352","Prestação de serviço de transporte a estabelecimento industrial","Prestação de serviço de transporte a estabelecimento industr","Classificam-se neste código as prestações de serviços de transporte a estabelecimento industrial. Também serão classificados neste código os serviços de transporte prestados a estabelecimento industrial de cooperativa.","output","cfop_6350","normal",2
"cfop_6353","6353","Prestação de serviço de transporte a estabelecimento comercial","Prestação de serviço de transporte a estabelecimento comerci","Classificam-se neste código as prestações de serviços de transporte a estabelecimento comercial. Também serão classificados neste código os serviços de transporte prestados a estabelecimento comercial de cooperativa.","output","cfop_6350","normal",2
"cfop_6354","6354","Prestação de serviço de transporte a estabelecimento de prestador de serviço de comunicação","Prestação de serviço de transporte a estabelecimento de pres","Classificam-se neste código as prestações de serviços de transporte a estabelecimento prestador de serviços de comunicação.","output","cfop_6350","normal",2
"cfop_6355","6355","Prestação de serviço de transporte a estabelecimento de geradora ou de distribuidora de energia elétrica","Prestação de serviço de transporte a estabelecimento de gera","Classificam-se neste código as prestações de serviços de transporte a estabelecimento de geradora ou de distribuidora de energia elétrica.","output","cfop_6350","normal",2
"cfop_6356","6356","Prestação de serviço de transporte a estabelecimento de produtor rural","Prestação de serviço de transporte a estabelecimento de prod","Classificam-se neste código as prestações de serviços de transporte a estabelecimento de produtor rural.","output","cfop_6350","normal",2
"cfop_6357","6357","Prestação de serviço de transporte a não contribuinte","Prestação de serviço de transporte a não contribuinte","Classificam-se neste código as prestações de serviços de transporte a pessoas físicas ou a pessoas jurídicas não indicadas nos códigos anteriores.","output","cfop_6350","normal",2
"cfop_6359","6359","Prestação de serviço de transporte a contribuinte ou a não contribuinte quando a mercadoria transportada está dispensada de emissão de nota fiscal","Prestação de serviço de transporte a contribuinte ou a não c","Classificam-se neste código as prestações de serviços de transporte a contribuintes ou a não contribuintes, exclusivamente quando não existe a obrigação legal de emissão de nota fiscal para a mercadoria transportada.","output","cfop_6350","normal",2
"cfop_6360","6360","Prestação de serviço de transporte a contribuinte substituto em relação ao serviço de transporte","Prestação de serviço de transporte a contribuinte substituto em relação ao serviço de transporte","Prestação de serviço de transporte a contribuinte substituto em relação ao serviço de transporte","output","cfop_6350","normal",2
"cfop_6400","6400","SAÍDAS DE MERCADORIAS SUJEITAS AO REGIME DE SUBSTITUIÇÃO TRIBUTÁRIA","SAÍDAS DE MERCADORIAS SUJEITAS AO REGIME DE SUBSTITUIÇÃO TRI",,"output","cfop_6000","view",2
"cfop_6401","6401","Venda de produção do estabelecimento em operação com produto sujeito ao regime de substituição tributária, na condição de contribuinte substituto","Venda de produção do estabelecimento em operação com produto","Classificam-se neste código as vendas de produtos industrializados ou produzido pelo próprio estabelecimento em operações com produtos sujeitos ao regime de substituição tributária, na condição de contribuinte substituto. Também serão classificadas neste código as vendas de produtos industrializados por estabelecimento industrial ou produtor rural de cooperativa sujeitos ao regime de substituição tributária, na condição de contribuinte substituto.","output","cfop_6400","normal",2
"cfop_6402","6402","Venda de produção do estabelecimento de produto sujeito ao regime de substituição tributária, em operação entre contribuintes substitutos do mesmo produto","Venda de produção do estabelecimento de produto sujeito ao r","Classificam-se neste código as vendas de produtos sujeitos ao regime de substituição tributária industrializados no estabelecimento, em operações entre contribuintes substitutos do mesmo produto.","output","cfop_6400","normal",2
"cfop_6403","6403","Venda de mercadoria adquirida ou recebida de terceiros em operação com mercadoria sujeita ao regime de substituição tributária, na condição de contribuinte substituto","Venda de mercadoria adquirida ou recebida de terceiros em op","Classificam-se neste código as vendas de mercadorias adquiridas ou recebidas de terceiros, na condição de contribuinte substituto, em operação com mercadorias sujeitas ao regime de substituição tributária.","output","cfop_6400","normal",2
"cfop_6404","6404","Venda de mercadoria sujeita ao regime de substituição tributária, cujo imposto já tenha sido retido anteriormente","Venda de mercadoria sujeita ao regime de substituição tribut","Classificam-se neste código as vendas de mercadorias sujeitas ao regime de substituição tributária, na condição de substituto tributário, exclusivamente nas hipóteses em que o imposto já tenha sido retido anteriormente.","output","cfop_6400","normal",2
"cfop_6408","6408","Transferência de produção do estabelecimento em operação com produto sujeito ao regime de substituição tributária","Transferência de produção do estabelecimento em operação com","Classificam-se neste código os produtos industrializados ou produzidos no próprio estabelecimento em transferência para outro estabelecimento da mesma empresa de produtos sujeitos ao regime de substituição tributária.","output","cfop_6400","normal",2
"cfop_6409","6409","Transferência de mercadoria adquirida ou recebida de terceiros em operação com mercadoria sujeita ao regime de substituição tributária","Transferência de mercadoria adquirida ou recebida de terceir","Classificam-se neste código as transferências para outro estabelecimento da mesma empresa, de mercadorias adquiridas ou recebidas de terceiros que não tenham sido objeto de qualquer processo industrial no estabelecimento, em operações com mercadorias sujeitas ao regime de substituição tributária.","output","cfop_6400","normal",2
"cfop_6410","6410","Devolução de compra para industrialização ou produção rural em operação com mercadoria sujeita ao regime de substituição tributária","Devolução de compra para industrialização ou produção rural ","Classificam-se neste código as devoluções de mercadorias adquiridas para serem utilizadas em processo de industrialização ou produção rural cujas entradas tenham sido classificadas como Compra para industrialização ou produção rural em operação com mercadoria sujeita ao regime de substituição tributária.","output","cfop_6400","normal",2
"cfop_6411","6411","Devolução de compra para comercialização em operação com mercadoria sujeita ao regime de substituição tributária","Devolução de compra para comercialização em operação com mer","Classificam-se neste código as devoluções de mercadorias adquiridas para serem comercializadas, cujas entradas tenham sido classificadas como Compra para comercialização em operação com mercadoria sujeita ao regime de substituição tributária.","output","cfop_6400","normal",2
"cfop_6412","6412","Devolução de bem do ativo imobilizado, em operação com mercadoria sujeita ao regime de substituição tributária","Devolução de bem do ativo imobilizado, em operação com merca","Classificam-se neste código as devoluções de bens adquiridos para integrar o ativo imobilizado do estabelecimento, cuja entrada tenha sido classificada no código 2.406 - Compra de bem para o ativo imobilizado cuja mercadoria está sujeita ao regime de substituição tributária.","output","cfop_6400","normal",2
"cfop_6413","6413","Devolução de mercadoria destinada ao uso ou consumo, em operação com mercadoria sujeita ao regime de substituição tributária","Devolução de mercadoria destinada ao uso ou consumo, em oper","Classificam-se neste código as devoluções de mercadorias adquiridas para uso ou consumo do estabelecimento, cuja entrada tenha sido classificada no código 2.407 - Compra de mercadoria para uso ou consumo cuja mercadoria está sujeita ao regime de substituição tributária.","output","cfop_6400","normal",2
