"id","code","name","small_name","description","type","parent_id:id","internal_type","id_dest"
"cfop_1000","1000","ENTRADAS OU AQUISIÇÕES DE SERVIÇOS DO ESTADO","ENTRADAS OU AQUISIÇÕES DE SERVIÇOS DO ESTADO","Classificam-se, neste grupo, as operações ou prestações em que o estabelecimento remetente esteja localizado na mesma unidade da Federação do destinatário","input",,"view",1
"cfop_1100","1100","COMPRAS PARA INDUSTRIALIZAÇÃO, PRODUÇÃO RURAL, COMERCIALIZAÇÃO OU PRESTAÇÃO DE SERVIÇOS","COMPRAS PARA INDUSTRIALIZAÇÃO, PRODUÇÃO RURAL, COMERCIALIZAÇ",,"input","cfop_1000","view",1
"cfop_1101","1101","Compra para industrialização ou produção rural","Compra para industrialização ou produção rural","Classificam-se neste código as compras de mercadorias a serem utilizadas em processo de industrialização ou produção rural. Também serão classificadas neste código as entradas de mercadorias em estabelecimento industrial ou produtor rural de cooperativa recebidas de seus cooperados ou de estabelecimento de outra cooperativa.","input","cfop_1100","normal",1
"cfop_1102","1102","Compra para comercialização","Compra para comercialização","Classificam-se neste código as compras de mercadorias a serem comercializadas. Também serão classificadas neste código as entradas de mercadorias em estabelecimento comercial de cooperativa recebidas de seus cooperados ou de estabelecimento de outra cooperativa.","input","cfop_1100","normal",1
"cfop_1111","1111","Compra para industrialização de mercadoria recebida anteriormente em consignação industrial","Compra para industrialização de mercadoria recebida anterior","Classificam-se neste código as compras efetivas de mercadorias a serem utilizadas em processo de industrialização, recebidas anteriormente a título de consignação industrial.","input","cfop_1100","normal",1
"cfop_1113","1113","Compra para comercialização, de mercadoria recebida anteriormente em consignação mercantil","Compra para comercialização, de mercadoria recebida anterior","Classificam-se neste código as compras efetivas de mercadorias recebidas anteriormente a título de consignação mercantil","input","cfop_1100","normal",1
"cfop_1116","1116","Compra para industrialização originada de encomenda para recebimento futuro","Compra para industrialização originada de encomenda para rec","Classificam-se neste código as compras de mercadorias a serem utilizadas em processo de industrialização ou produção rural, quando da entrada real da mercadoria, cuja aquisição tenha sido classificada no código 1.922  Lançamento efetuado a título de simples faturamento decorrente de compra para recebimento futuro.","input","cfop_1100","normal",1
"cfop_1117","1117","Compra para comercialização originada de encomenda para recebimento futuro","Compra para comercialização originada de encomenda para rece","Classificam-se neste código as compras de mercadorias a serem comercializadas, quando da entrada real da mercadoria, cuja aquisição tenha sido classificada no código 1.922 - Lançamento efetuado a título de simples faturamento decorrente de compra para recebimento futuro.","input","cfop_1100","normal",1
"cfop_1118","1118","Compra de mercadoria para comercialização pelo adquirente originário, entregue pelo vendedor remetente ao destinatário, em venda à ordem","Compra de mercadoria para comercialização pelo adquirente or","Classificam-se neste código as compras de mercadorias já comercializadas, que, sem transitar pelo estabelecimento do adquirente originário, sejam entregues pelo vendedor remetente diretamente ao destinatário, em operação de venda à ordem, cuja venda seja classificada, pelo adquirente originário, no código 5.120 - Venda de mercadoria adquirida ou recebida de terceiros entregue ao destinatário pelo vendedor remetente, em venda à ordem","input","cfop_1100","normal",1
"cfop_1120","1120","Compra para industrialização, em venda à ordem, já recebida do vendedor remetente","Compra para industrialização, em venda à ordem, já recebida ","Classificam-se neste código as compras de mercadorias a serem utilizadas em processo de industrialização, em vendas à ordem, já recebidas do vendedor remetente, por ordem do adquirente originário.","input","cfop_1100","normal",1
"cfop_1121","1121","Compra para comercialização, em venda à ordem, já recebida do vendedor remetente","Compra para comercialização, em venda à ordem, já recebida d","Classificam-se neste código as compras de mercadorias a serem comercializadas, em vendas à ordem, já recebidas do vendedor remetente por ordem do adquirente originário.","input","cfop_1100","normal",1
"cfop_1122","1122","Compra para industrialização em que a mercadoria foi remetida pelo fornecedor ao industrializador sem transitar pelo estabelecimento adquirente","Compra para industrialização em que a mercadoria foi remetid","Classificam-se neste código as compras de mercadorias a serem utilizadas em processo de industrialização, remetidas pelo fornecedor para o industrializador sem que a mercadoria tenha transitado pelo estabelecimento do adquirente.","input","cfop_1100","normal",1
"cfop_1124","1124","Industrialização efetuada por outra empresa","Industrialização efetuada por outra empresa","Classificam-se neste código as entradas de mercadorias industrializadas por terceiros, compreendendo os valores referentes aos serviços prestados e os das mercadorias de propriedade do industrializador empregadas no processo industrial. Quando a industrialização efetuada se referir a bens do ativo imobilizado ou de mercadorias para uso ou consumo do estabelecimento encomendante, a entrada deverá ser classificada nos códigos 1.551 - Compra de bem para o ativo imobilizado ou 1.556 - Compra de material para uso ou consumo.","input","cfop_1100","normal",1
"cfop_1125","1125","Industrialização efetuada por outra empresa quando a mercadoria remetida para utilização no processo de industrialização não transitou pelo estabelecimento adquirente da mercadoria","Industrialização efetuada por outra empresa quando a mercado","Classificam-se neste código as entradas de mercadorias industrializadas por outras empresas, em que as mercadorias remetidas para utilização no processo de industrialização não transitaram pelo estabelecimento do adquirente das mercadorias, compreendendo os valores referentes aos serviços prestados e os das mercadorias de propriedade do industrializador empregadas no processo industrial. Quando a industrialização efetuada se referir a bens do ativo imobilizado ou de mercadorias para uso ou consumo do estabelecimento encomendante, a entrada deverá ser classificada nos códigos 1.551 - Compra de bem para o ativo imobilizado ou 1.556 - Compra de material para uso ou consumo.","input","cfop_1100","normal",1
"cfop_1126","1126","Compra para utilização na prestação de serviço","Compra para utilização na prestação de serviço","Classificam-se neste código as entradas de mercadorias a serem utilizadas nas prestações de serviços.","input","cfop_1100","normal",1
"cfop_1128","1128","Compra para utilização na prestação de serviço sujeita ao ISSQN","Compra para utilização na prestação de serviço sujeita ao ISSQN","Compra para utilização na prestação de serviço sujeita ao ISSQN","input","cfop_1100","normal",1
"cfop_1150","1150","TRANSFERÊNCIAS PARA INDUSTRIALIZAÇÃO, COMERCIALIZAÇÃO OU PRESTAÇÃO DE SERVIÇOS","TRANSFERÊNCIAS PARA INDUSTRIALIZAÇÃO, COMERCIALIZAÇÃO OU PRE",,"input","cfop_1000","view",1
"cfop_1151","1151","Transferência para industrialização ou produção rural","Transferência para industrialização ou produção rural","Classificam-se neste código as entradas de mercadorias recebidas em transferência de outro estabelecimento da mesma empresa, para serem utilizadas em processo de industrialização ou produção rural.","input","cfop_1150","normal",1
"cfop_1152","1152","Transferência para comercialização","Transferência para comercialização","Classificam-se neste código as entradas de mercadorias recebidas em transferência de outro estabelecimento da mesma empresa, para serem comercializadas.","input","cfop_1150","normal",1
"cfop_1153","1153","Transferência de energia elétrica para distribuição","Transferência de energia elétrica para distribuição","Classificam-se neste código as entradas de energia elétrica recebida em transferência de outro estabelecimento da mesma empresa, para distribuição.","input","cfop_1150","normal",1
"cfop_1154","1154","Transferência para utilização na prestação de serviço","Transferência para utilização na prestação de serviço","Classificam-se neste código as entradas de mercadorias recebidas em transferência de outro estabelecimento da mesma empresa, para serem utilizadas nas prestações de serviços.","input","cfop_1150","normal",1
"cfop_1200","1200","DEVOLUÇÕES DE VENDAS DE PRODUÇÃO PRÓPRIA, DE TERCEIROS OU ANULAÇÕES DE VALORES","DEVOLUÇÕES DE VENDAS DE PRODUÇÃO PRÓPRIA, DE TERCEIROS OU AN",,"input","cfop_1000","view",1
"cfop_1201","1201","Devolução de venda de produção do estabelecimento","Devolução de venda de produção do estabelecimento","Classificam-se neste código as devoluções de vendas de mercadorias adquiridas ou recebidas de terceiros, que não tenham sido objeto de industrialização no estabelecimento, cujas saídas tenham sido classificadas como Venda de mercadoria adquirida ou recebida de terceiros","input","cfop_1200","normal",1
"cfop_1202","1202","Devolução de venda de mercadoria adquirida ou recebida de terceiros","Devolução de venda de mercadoria adquirida ou recebida de te","Classificam-se neste código as devoluções de vendas de mercadorias adquiridas ou recebidas de terceiros, que não tenham sido objeto de industrialização no estabelecimento, cujas saídas tenham sido classificadas como Venda de mercadoria adquirida ou recebida de terceiros","input","cfop_1200","normal",1
"cfop_1203","1203","Devolução de venda de produção do estabelecimento, destinada à Zona Franca de Manaus ou Áreas de Livre Comércio","Devolução de venda de produção do estabelecimento, destinada","Classificam-se neste código as devoluções de vendas de produtos industrializados ou produzidos pelo próprio estabelecimento, cujas saídas foram classificadas no código 5.109 - Venda de produção do estabelecimento, destinada à Zona Franca de Manaus ou Áreas de Livre Comércio","input","cfop_1200","normal",1
"cfop_1204","1204","Devolução de venda de mercadoria adquirida ou recebida de terceiros, destinada à Zona Franca de Manaus ou Áreas de Livre Comércio","Devolução de venda de mercadoria adquirida ou recebida de te","Classificam-se neste código as devoluções de vendas de mercadorias adquiridas ou recebidas de terceiros, cujas saídas foram classificadas no código 5.110 - Venda de mercadoria adquirida ou recebida de terceiros, destinada à Zona Franca de Manaus ou Áreas de Livre Comércio","input","cfop_1200","normal",1
"cfop_1205","1205","Anulação de valor relativo à prestação de serviço de comunicação","Anulação de valor relativo à prestação de serviço de comunic","Classificam-se neste código as anulações correspondentes a valores faturados indevidamente, decorrentes de prestações de serviços de comunicação.","input","cfop_1200","normal",1
"cfop_1206","1206","Anulação de valor relativo à prestação de serviço de transporte","Anulação de valor relativo à prestação de serviço de transpo","Classificam-se neste código as anulações correspondentes a valores faturados indevidamente, decorrentes de prestações de serviços de transporte.","input","cfop_1200","normal",1
"cfop_1207","1207","Anulação de valor relativo à venda de energia elétrica","Anulação de valor relativo à venda de energia elétrica","Classificam-se neste código as anulações correspondentes a valores faturados indevidamente, decorrentes de venda de energia elétrica.","input","cfop_1200","normal",1
"cfop_1208","1208","Devolução de produção do estabelecimento, remetida em transferência","Devolução de produção do estabelecimento, remetida em transf","Classificam-se neste código as devoluções de produtos industrializados ou produzidos pelo próprio estabelecimento, transferidos para outros estabelecimentos da mesma empresa.","input","cfop_1200","normal",1
"cfop_1209","1209","Devolução de mercadoria adquirida ou recebida de terceiros, remetida em transferência","Devolução de mercadoria adquirida ou recebida de terceiros, ","Classificam-se neste código as devoluções de mercadorias adquiridas ou recebidas de terceiros, transferidas para outros estabelecimentos da mesma empresa.","input","cfop_1200","normal",1
"cfop_1212","1212","Devolução de venda no mercado interno de mercadoria industrializada e insumo importado sob o Regime Aduaneiro Especial de Entreposto Industrial (Recof-Sped)", "Devolução de venda (Recof-Sped)","Classificam-se neste código as devoluções de venda no mercado interno de mercadoria industrializada e insumo importado sob o Regime Aduaneiro Especial de Entreposto Industrial (Recof-Sped).","input","cfop_1200","normal",1
"cfop_1250","1250","COMPRAS DE ENERGIA ELÉTRICA","COMPRAS DE ENERGIA ELÉTRICA",,"input","cfop_1000","view",1
"cfop_1251","1251","Compra de energia elétrica para distribuição ou comercialização","Compra de energia elétrica para distribuição ou comercializa","Classificam-se neste código as compras de energia elétrica utilizada em sistema de distribuição ou comercialização. Também serão classificadas neste código as compras de energia elétrica por cooperativas para distribuição aos seus cooperados.","input","cfop_1250","normal",1
"cfop_1252","1252","Compra de energia elétrica por estabelecimento industrial","Compra de energia elétrica por estabelecimento industrial","Classificam-se neste código as compras de energia elétrica utilizada no processo de industrialização. Também serão classificadas neste código as compras de energia elétrica utilizada por estabelecimento industrial de cooperativa.","input","cfop_1250","normal",1
"cfop_1253","1253","Compra de energia elétrica por estabelecimento comercial","Compra de energia elétrica por estabelecimento comercial","Classificam-se neste código as compras de energia elétrica utilizada por estabelecimento comercial. Também serão classificadas neste código as compras de energia elétrica utilizada por estabelecimento comercial de cooperativa.","input","cfop_1250","normal",1
"cfop_1254","1254","Compra de energia elétrica por estabelecimento prestador de serviço de transporte","Compra de energia elétrica por estabelecimento prestador de ","Classificam-se neste código as compras de energia elétrica utilizada por estabelecimento prestador de serviços de transporte.","input","cfop_1250","normal",1
"cfop_1255","1255","Compra de energia elétrica por estabelecimento prestador de serviço de comunicação","Compra de energia elétrica por estabelecimento prestador de ","Classificam-se neste código as compras de energia elétrica utilizada por estabelecimento prestador de serviços de comunicação.","input","cfop_1250","normal",1
"cfop_1256","1256","Compra de energia elétrica por estabelecimento de produtor rural","Compra de energia elétrica por estabelecimento de produtor r","Classificam-se neste código as compras de energia elétrica utilizada por estabelecimento de produtor rural.","input","cfop_1250","normal",1
"cfop_1257","1257","Compra de energia elétrica para consumo por demanda contratada","Compra de energia elétrica para consumo por demanda contrata","Classificam-se neste código as compras de energia elétrica para consumo por demanda contratada, que prevalecerá sobre os demais códigos deste subgrupo.","input","cfop_1250","normal",1
"cfop_1300","1300","AQUISIÇÕES DE SERVIÇOS DE COMUNICAÇÃO","AQUISIÇÕES DE SERVIÇOS DE COMUNICAÇÃO",,"input","cfop_1000","view",1
"cfop_1301","1301","Aquisição de serviço de comunicação para execução de serviço da mesma natureza","Aquisição de serviço de comunicação para execução de serviço","Classificam-se neste código as aquisições de serviços de comunicação utilizados nas prestações de serviços da mesma natureza.","input","cfop_1300","normal",1
"cfop_1302","1302","Aquisição de serviço de comunicação por estabelecimento industrial","Aquisição de serviço de comunicação por estabelecimento indu","Classificam-se neste código as aquisições de serviços de comunicação utilizados por estabelecimento industrial. Também serão classificadas neste código as aquisições de serviços de comunicação utilizados por estabelecimento industrial de cooperativa.","input","cfop_1300","normal",1
"cfop_1303","1303","Aquisição de serviço de comunicação por estabelecimento comercial","Aquisição de serviço de comunicação por estabelecimento come","Classificam-se neste código as aquisições de serviços de comunicação utilizados por estabelecimento comercial. Também serão classificadas neste código as aquisições de serviços de comunicação utilizados por estabelecimento comercial de cooperativa.","input","cfop_1300","normal",1
"cfop_1304","1304","Aquisição de serviço de comunicação por estabelecimento de prestador de serviço de transporte","Aquisição de serviço de comunicação por estabelecimento de p","Classificam-se neste código as aquisições de serviços de comunicação utilizados por estabelecimento prestador de serviço de transporte.","input","cfop_1300","normal",1
"cfop_1305","1305","Aquisição de serviço de comunicação por estabelecimento de geradora ou de distribuidora de energia elétrica","Aquisição de serviço de comunicação por estabelecimento de g","Classificam-se neste código as aquisições de serviços de comunicação utilizados por estabelecimento de geradora ou de distribuidora de energia elétrica.","input","cfop_1300","normal",1
"cfop_1306","1306","Aquisição de serviço de comunicação por estabelecimento de produtor rural","Aquisição de serviço de comunicação por estabelecimento de p","Classificam-se neste código as aquisições de serviços de comunicação utilizados por estabelecimento de produtor rural.","input","cfop_1300","normal",1
"cfop_1350","1350","AQUISIÇÕES DE SERVIÇOS DE TRANSPORTE","AQUISIÇÕES DE SERVIÇOS DE TRANSPORTE",,"input","cfop_1000","view",1
"cfop_1351","1351","Aquisição de serviço de transporte para execução de serviço da mesma natureza","Aquisição de serviço de transporte para execução de serviço ","Classificam-se neste código as aquisições de serviços de transporte utilizados nas prestações de serviços da mesma natureza.","input","cfop_1350","normal",1
"cfop_1352","1352","Aquisição de serviço de transporte por estabelecimento industrial","Aquisição de serviço de transporte por estabelecimento indus","Classificam-se neste código as aquisições de serviços de transporte utilizados por estabelecimento industrial. Também serão classificadas neste código as aquisições de serviços de transporte utilizados por estabelecimento industrial de cooperativa.","input","cfop_1350","normal",1
"cfop_1353","1353","Aquisição de serviço de transporte por estabelecimento comercial","Aquisição de serviço de transporte por estabelecimento comer","Classificam-se neste código as aquisições de serviços de transporte utilizados por estabelecimento comercial. Também serão classificadas neste código as aquisições de serviços de transporte utilizados por estabelecimento comercial de cooperativa.","input","cfop_1350","normal",1
"cfop_1354","1354","Aquisição de serviço de transporte por estabelecimento de prestador de serviço de comunicação","Aquisição de serviço de transporte por estabelecimento de pr","Classificam-se neste código as aquisições de serviços de transporte utilizados por estabelecimento prestador de serviços de comunicação.","input","cfop_1350","normal",1
"cfop_1355","1355","Aquisição de serviço de transporte por estabelecimento de geradora ou de distribuidora de energia elétrica","Aquisição de serviço de transporte por estabelecimento de ge","Classificam-se neste código as aquisições de serviços de transporte utilizados por estabelecimento de geradora ou de distribuidora de energia elétrica.","input","cfop_1350","normal",1
"cfop_1356","1356","Aquisição de serviço de transporte por estabelecimento de produtor rural","Aquisição de serviço de transporte por estabelecimento de pr","Classificam-se neste código as aquisições de serviços de transporte utilizados por estabelecimento de produtor rural.","input","cfop_1350","normal",1
"cfop_1360","1360","Aquisição de serviço de transporte por contribuinte substituto em relação ao serviço de transporte.","Aquisição de serviço de transporte por contribuinte substituto em relação ao serviço de transporte.","Aquisição de serviço de transporte por contribuinte substituto em relação ao serviço de transporte.","input","cfop_1350","normal",1
"cfop_1400","1400","ENTRADAS DE MERCADORIAS SUJEITAS AO REGIME DE SUBSTITUIÇÃO TRIBUTÁRIA","ENTRADAS DE MERCADORIAS SUJEITAS AO REGIME DE SUBSTITUIÇÃO T",,"input","cfop_1000","view",1
"cfop_1401","1401","Compra para industrialização ou produção rural em operação com mercadoria sujeita ao regime de substituição tributária","Compra para industrialização ou produção rural em operação c","Classificam-se neste código as compras de mercadorias a serem utilizadas em processo de industrialização ou produção rural, decorrentes de operações com mercadorias sujeitas ao regime de substituição tributária. Também serão classificadas neste código as compras por estabelecimento industrial ou produtor rural de cooperativa de mercadorias sujeitas ao regime de substituição tributária.","input","cfop_1400","normal",1
"cfop_1403","1403","Compra para comercialização em operação com mercadoria sujeita ao regime de substituição tributária","Compra para comercialização em operação com mercadoria sujei","Classificam-se neste código as compras de mercadorias a serem comercializadas, decorrentes de operações com mercadorias sujeitas ao regime de substituição tributária. Também serão classificadas neste código as compras de mercadorias sujeitas ao regime de substituição tributária em estabelecimento comercial de cooperativa.","input","cfop_1400","normal",1
"cfop_1406","1406","Compra de bem para o ativo imobilizado cuja mercadoria está sujeita ao regime de substituição tributária","Compra de bem para o ativo imobilizado cuja mercadoria está ","Classificam-se neste código as compras de bens destinados ao ativo imobilizado do estabelecimento, em operações com mercadorias sujeitas ao regime de substituição tributária.","input","cfop_1400","normal",1
"cfop_1407","1407","Compra de mercadoria para uso ou consumo cuja mercadoria está sujeita ao regime de substituição tributária","Compra de mercadoria para uso ou consumo cuja mercadoria est","Classificam-se neste código as compras de mercadorias destinadas ao uso ou consumo do estabelecimento, em operações com mercadorias sujeitas ao regime de substituição tributária.","input","cfop_1400","normal",1
"cfop_1408","1408","Transferência para industrialização ou produção rural em operação com mercadoria sujeita ao regime de substituição tributária","Transferência para industrialização ou produção rural em ope","Classificam-se neste código as mercadorias recebidas em transferência de outro estabelecimento da mesma empresa, para serem industrializadas ou consumidas na produção rural no estabelecimento, em operações com mercadorias sujeitas ao regime de substituição tributária.","input","cfop_1400","normal",1
"cfop_1409","1409","Transferência para comercialização em operação com mercadoria sujeita ao regime de substituição tributária","Transferência para comercialização em operação com mercadori","Classificam-se neste código as mercadorias recebidas em transferência de outro estabelecimento da mesma empresa, para serem comercializadas, decorrentes de operações sujeitas ao regime de substituição tributária.","input","cfop_1400","normal",1
"cfop_1410","1410","Devolução de venda de produção do estabelecimento em operação com produto sujeito ao regime de substituição tributária","Devolução de venda de produção do estabelecimento em operaçã","Classificam-se neste código as devoluções de produtos industrializados ou produzidos pelo próprio estabelecimento, cujas saídas tenham sido classificadas como Venda de produção do estabelecimento em operação com produto sujeito ao regime de substituição tributária.","input","cfop_1400","normal",1
"cfop_1411","1411","Devolução de venda de mercadoria adquirida ou recebida de terceiros em operação com mercadoria sujeita ao regime de substituição tributária","Devolução de venda de mercadoria adquirida ou recebida de te","Classificam-se neste código as devoluções de vendas de mercadorias adquiridas ou recebidas de terceiros, cujas saídas tenham sido classificadas como Venda de mercadoria adquirida ou recebida de terceiros em operação com mercadoria sujeita ao regime de substituição tributária.","input","cfop_1400","normal",1
