"id","code","name","small_name","description","type","parent_id:id","internal_type","id_dest"
"cfop_3251","3251","Compra de energia elétrica para distribuição ou comercialização","Compra de energia elétrica para distribuição ou comercializa","Classificam-se neste código as compras de energia elétrica utilizada em sistema de distribuição ou comercialização. Também serão classificadas neste código as compras de energia elétrica por cooperativas para distribuição aos seus cooperados.","input","cfop_3250","normal",3
"cfop_3300","3300","AQUISIÇÕES DE SERVIÇOS DE COMUNICAÇÃO","AQUISIÇÕES DE SERVIÇOS DE COMUNICAÇÃO",,"input","cfop_3000","view",3
"cfop_3301","3301","Aquisição de serviço de comunicação para execução de serviço da mesma natureza","Aquisição de serviço de comunicação para execução de serviço","Classificam-se neste código as aquisições de serviços de comunicação utilizados nas prestações de serviços da mesma natureza.","input","cfop_3300","normal",3
"cfop_3350","3350","AQUISIÇÕES DE SERVIÇOS DE TRANSPORTE","AQUISIÇÕES DE SERVIÇOS DE TRANSPORTE","Aquisição de serviço de transporte para execução de serviço da mesma natureza","input","cfop_3000","view",3
"cfop_3351","3351","Aquisição de serviço de transporte para execução de serviço da mesma natureza","Aquisição de serviço de transporte para execução de serviço ","Classificam-se neste código as aquisições de serviços de transporte utilizados nas prestações de serviços da mesma natureza.","input","cfop_3350","normal",3
"cfop_3352","3352","Aquisição de serviço de transporte por estabelecimento industrial","Aquisição de serviço de transporte por estabelecimento indus","Classificam-se neste código as aquisições de serviços de transporte utilizados por estabelecimento industrial. Também serão classificadas neste código as aquisições de serviços de transporte utilizados por estabelecimento industrial de cooperativa.","input","cfop_3350","normal",3
"cfop_3353","3353","Aquisição de serviço de transporte por estabelecimento comercial","Aquisição de serviço de transporte por estabelecimento comer","Classificam-se neste código as aquisições de serviços de transporte utilizados por estabelecimento comercial. Também serão classificadas neste código as aquisições de serviços de transporte utilizados por estabelecimento comercial de cooperativa.","input","cfop_3350","normal",3
"cfop_3354","3354","Aquisição de serviço de transporte por estabelecimento de prestador de serviço de comunicação","Aquisição de serviço de transporte por estabelecimento de pr","Classificam-se neste código as aquisições de serviços de transporte utilizados por estabelecimento prestador de serviços de comunicação.","input","cfop_3350","normal",3
"cfop_3355","3355","Aquisição de serviço de transporte por estabelecimento de geradora ou de distribuidora de energia elétrica","Aquisição de serviço de transporte por estabelecimento de ge","Classificam-se neste código as aquisições de serviços de transporte utilizados por estabelecimento de geradora ou de distribuidora de energia elétrica.","input","cfop_3350","normal",3
"cfop_3356","3356","Aquisição de serviço de transporte por estabelecimento de produtor rural","Aquisição de serviço de transporte por estabelecimento de pr","Classificam-se neste código as aquisições de serviços de transporte utilizados por estabelecimento de produtor rural.","input","cfop_3350","normal",3
"cfop_3500","3500","ENTRADAS DE MERCADORIAS REMETIDAS COM FIM ESPECÍFICO DE EXPORTAÇÃO E EVENTUAIS DEVOLUÇÕES","ENTRADAS DE MERCADORIAS REMETIDAS COM FIM ESPECÍFICO DE EXPO",,"input","cfop_3000","view",3
"cfop_3503","3503","Devolução de mercadoria exportada que tenha sido recebida com fim específico de exportação","Devolução de mercadoria exportada que tenha sido recebida co","Classificam-se neste código as devoluções de mercadorias exportadas por trading company, empresa comercial exportadora ou outro estabelecimento do remetente, recebidas com fim específico de exportação, cujas saídas tenham sido classificadas no código 7.501 - Exportação de mercadorias recebidas com fim específico de exportação.","input","cfop_3500","normal",3
"cfop_3550","3550","OPERAÇÕES COM BENS DE ATIVO IMOBILIZADO E MATERIAIS PARA USO OU CONSUMO","OPERAÇÕES COM BENS DE ATIVO IMOBILIZADO E MATERIAIS PARA USO",,"input","cfop_3000","view",3
"cfop_3551","3551","Compra de bem para o ativo imobilizado","Compra de bem para o ativo imobilizado","Classificam-se neste código as compras de bens destinados ao ativo imobilizado do estabelecimento.","input","cfop_3550","normal",3
"cfop_3553","3553","Devolução de venda de bem do ativo imobilizado","Devolução de venda de bem do ativo imobilizado","Classificam-se neste código as devoluções de vendas de bens do ativo imobilizado, cujas saídas tenham sido classificadas no código 7.551 - Venda de bem do ativo imobilizado.","input","cfop_3550","normal",3
"cfop_3556","3556","Compra de material para uso ou consumo","Compra de material para uso ou consumo","Classificam-se neste código as compras de mercadorias destinadas ao uso ou consumo do estabelecimento.","input","cfop_3550","normal",3
"cfop_3650","3650","ENTRADAS DE COMBUSTÍVEIS, DERIVADOS OU NÃO DE PETRÓLEO E LUBRIFICANTES","ENTRADAS DE COMBUSTÍVEIS, DERIVADOS OU NÃO DE PETRÓLEO E LUB",,"input","cfop_3000","view",3
"cfop_3651","3651","Compra de combustível ou lubrificante para industrialização subseqüente","Compra de combustível ou lubrificante para industrialização ","Classificam-se neste código as compras de combustíveis ou lubrificantes a serem utilizados em processo de industrialização do próprio produto.","input","cfop_3650","normal",3
"cfop_3652","3652","Compra de combustível ou lubrificante para comercialização","Compra de combustível ou lubrificante para comercialização","Classificam-se neste código as compras de combustíveis ou lubrificantes a serem comercializados.","input","cfop_3650","normal",3
"cfop_3653","3653","Compra de combustível ou lubrificante por consumidor ou usuário final","Compra de combustível ou lubrificante por consumidor ou usuá","Classificam-se neste código as compras de combustíveis ou lubrificantes a serem consumidos em processo de industrialização de outros produtos, na produção rural, na prestação de serviços ou por usuário final.","input","cfop_3650","normal",3
"cfop_3900","3900","OUTRAS ENTRADAS DE MERCADORIAS OU AQUISIÇÕES DE SERVIÇOS","OUTRAS ENTRADAS DE MERCADORIAS OU AQUISIÇÕES DE SERVIÇOS",,"input","cfop_3000","view",3
"cfop_3930","3930","Lançamento efetuado a título de entrada de bem sob amparo de regime especial aduaneiro de admissão temporária","Lançamento efetuado a título de entrada de bem sob amparo de","Classificam-se neste código os lançamentos efetuados a título de entrada de bens amparada por regime especial aduaneiro de admissão temporária.","input","cfop_3900","normal",3
"cfop_3949","3949","Outra entrada de mercadoria ou prestação de serviço não especificado","Outra entrada de mercadoria ou prestação de serviço não espe","Classificam-se neste código as outras entradas de mercadorias ou prestações de serviços que não tenham sido especificados nos códigos anteriores.","input","cfop_3900","normal",3
"cfop_5000","5000","SAÍDAS OU PRESTAÇÕES DE SERVIÇOS PARA O ESTADO","SAÍDAS OU PRESTAÇÕES DE SERVIÇOS PARA O ESTADO",,"output",,"view",1
"cfop_5100","5100","VENDAS DE PRODUÇÃO PRÓPRIA OU DE TERCEIROS","VENDAS DE PRODUÇÃO PRÓPRIA OU DE TERCEIROS",,"output","cfop_5000","view",1
"cfop_5101","5101","Venda de produção do estabelecimento","Venda de produção do estabelecimento","Classificam-se neste código as vendas de produtos industrializados ou produzidos pelo próprio estabelecimento. Também serão classificadas neste código as vendas de mercadorias por estabelecimento industrial ou produtor rural de cooperativa destinadas a seus cooperados ou a estabelecimento de outra cooperativa.","output","cfop_5100","normal",1
"cfop_5102","5102","Venda de mercadoria adquirida ou recebida de terceiros","Venda de mercadoria adquirida ou recebida de terceiros","Classificam-se neste código as vendas de mercadorias adquiridas ou recebidas de terceiros para industrialização ou comercialização, que não tenham sido objeto de qualquer processo industrial no estabelecimento. Também serão classificadas neste código as vendas de mercadorias por estabelecimento comercial de cooperativa destinadas a seus cooperados ou estabelecimento de outra cooperativa.","output","cfop_5100","normal",1
"cfop_5103","5103","Venda de produção do estabelecimento, efetuada fora do estabelecimento","Venda de produção do estabelecimento, efetuada fora do estab","Classificam-se neste código as vendas efetuadas fora do estabelecimento, inclusive por meio de veículo, de produtos industrializados ou produzidos pelo próprio estabelecimento.","output","cfop_5100","normal",1
"cfop_5104","5104","Venda de mercadoria adquirida ou recebida de terceiros, efetuada fora do estabelecimento","Venda de mercadoria adquirida ou recebida de terceiros, efet","Classificam-se neste código as vendas efetuadas fora do estabelecimento, inclusive por meio de veículo, de mercadorias adquiridas ou recebidas de terceiros para industrialização ou comercialização, que não tenham sido objeto de qualquer processo industrial no estabelecimento.","output","cfop_5100","normal",1
"cfop_5105","5105","Venda de produção do estabelecimento que não deva por ele transitar","Venda de produção do estabelecimento que não deva por ele tr","Classificam-se neste código as vendas de produtos industrializados no estabelecimento, armazenados em depósito fechado, armazém geral ou outro sem que haja retorno ao estabelecimento depositante.","output","cfop_5100","normal",1
"cfop_5106","5106","Venda de mercadoria adquirida ou recebida de terceiros, que não deva por ele transitar","Venda de mercadoria adquirida ou recebida de terceiros, que ","Classificam-se neste código as vendas de mercadorias adquiridas ou recebidas de terceiros para industrialização ou comercialização, armazenadas em depósito fechado, armazém geral ou outro, que não tenham sido objeto de qualquer processo industrial no estabelecimento sem que haja retorno ao estabelecimento depositante. Também serão classificadas neste código as vendas de mercadorias importadas, cuja saída ocorra do recinto alfandegado ou da repartição alfandegária onde se processou o desembaraço aduaneiro, com destino ao estabelecimento do comprador, sem transitar pelo estabelecimento do importador.","output","cfop_5100","normal",1
"cfop_5109","5109","Venda de produção do estabelecimento, destinada à Zona Franca de Manaus ou Áreas de Livre Comércio","Venda de produção do estabelecimento, destinada à Zona Franc","Classificam-se neste código as vendas de produtos industrializados ou produzidos pelo próprio estabelecimento, destinados à Zona Franca de Manaus ou Áreas de Livre Comércio","output","cfop_5100","normal",1
"cfop_5110","5110","Venda de mercadoria adquirida ou recebida de terceiros, destinada à Zona Franca de Manaus ou Áreas de Livre Comércio","Venda de mercadoria adquirida ou recebida de terceiros, dest","Classificam-se neste código as vendas de mercadorias adquiridas ou recebidas de terceiros, destinadas à Zona Franca de Manaus ou Áreas de Livre Comércio, desde que alcançadas pelos benefícios fiscais de que tratam o Decreto-lei n° 288, de 28 de fevereiro de 1967, o Convênio ICM 65/88, de 6 de dezembro de 1988, o Convênio ICMS 36/97, de 23 de maio de 1997 e o Convênio ICMS 37/97, de 23 de maio de 1997.","output","cfop_5100","normal",1
"cfop_5111","5111","Venda de produção do estabelecimento remetida anteriormente em consignação industrial","Venda de produção do estabelecimento remetida anteriormente ","Classificam-se neste código as vendas efetivas de produtos industrializados no estabelecimento remetidos anteriormente a título de consignação industrial.","output","cfop_5100","normal",1
"cfop_5112","5112","Venda de mercadoria adquirida ou recebida de terceiros remetida anteriormente em consignação industrial","Venda de mercadoria adquirida ou recebida de terceiros remet","Classificam-se neste código as vendas efetivas de mercadorias adquiridas ou recebidas de terceiros, que não tenham sido objeto de qualquer processo industrial no estabelecimento, remetidas anteriormente a título de consignação industrial.","output","cfop_5100","normal",1
"cfop_5113","5113","Venda de produção do estabelecimento remetida anteriormente em consignação mercantil","Venda de produção do estabelecimento remetida anteriormente ","Classificam-se neste código as vendas efetivas de produtos industrializados no estabelecimento remetidos anteriormente a título de consignação mercantil.","output","cfop_5100","normal",1
"cfop_5114","5114","Venda de mercadoria adquirida ou recebida de terceiros remetida anteriormente em consignação mercantil","Venda de mercadoria adquirida ou recebida de terceiros remet","Classificam-se neste código as vendas efetivas de mercadorias adquiridas ou recebidas de terceiros, que não tenham sido objeto de qualquer processo industrial no estabelecimento, remetidas anteriormente a título de consignação mercantil.","output","cfop_5100","normal",1
"cfop_5115","5115","Venda de mercadoria adquirida ou recebida de terceiros, recebida anteriormente em consignação mercantil","Venda de mercadoria adquirida ou recebida de terceiros, rece","Classificam-se neste código as vendas de mercadorias adquiridas ou recebidas de terceiros, recebidas anteriormente a título de consignação mercantil.","output","cfop_5100","normal",1
"cfop_5116","5116","Venda de produção do estabelecimento originada de encomenda para entrega futura","Venda de produção do estabelecimento originada de encomenda ","Classificam-se neste código as vendas de produtos industrializados ou produzidos pelo próprio estabelecimento, quando da saída real do produto, cujo faturamento tenha sido classificado no código 5.922  Lançamento efetuado a título de simples faturamento decorrente de venda para entrega futura.","output","cfop_5100","normal",1
"cfop_5117","5117","Venda de mercadoria adquirida ou recebida de terceiros, originada de encomenda para entrega futura","Venda de mercadoria adquirida ou recebida de terceiros, orig","Classificam-se neste código as vendas de mercadorias adquiridas ou recebidas de terceiros, que não tenham sido objeto de qualquer processo industrial no estabelecimento, quando da saída real da mercadoria, cujo faturamento tenha sido classificado no código 5.922 - Lançamento efetuado a título de simples faturamento decorrente de venda para entrega futura.","output","cfop_5100","normal",1
"cfop_5118","5118","Venda de produção do estabelecimento entregue ao destinatário por conta e ordem do adquirente originário, em venda à ordem","Venda de produção do estabelecimento entregue ao destinatári","Classificam-se neste código as vendas à ordem de produtos industrializados pelo estabelecimento, entregues ao destinatário por conta e ordem do adquirente originário.","output","cfop_5100","normal",1
"cfop_5119","5119","Venda de mercadoria adquirida ou recebida de terceiros entregue ao destinatário por conta e ordem do adquirente originário, em venda à ordem","Venda de mercadoria adquirida ou recebida de terceiros entre","Classificam-se neste código as vendas à ordem de mercadorias adquiridas ou recebidas de terceiros, que não tenham sido objeto de qualquer processo industrial no estabelecimento, entregues ao destinatário por conta e ordem do adquirente originário.","output","cfop_5100","normal",1
"cfop_5120","5120","Venda de mercadoria adquirida ou recebida de terceiros entregue ao destinatário pelo vendedor remetente, em venda à ordem","Venda de mercadoria adquirida ou recebida de terceiros entre","Classificam-se neste código as vendas à ordem de mercadorias adquiridas ou recebidas de terceiros, que não tenham sido objeto de qualquer processo industrial no estabelecimento, entregues pelo vendedor remetente ao destinatário, cuja compra seja classificada, pelo adquirente originário, no código 1.118 - Compra de mercadoria pelo adquirente originário, entregue pelo vendedor remetente ao destinatário, em venda à ordem.","output","cfop_5100","normal",1
"cfop_5121","5121","Venda de produção do estabelecimento remetida para industrialização, por conta e ordem do adquirente, sem transitar pelo estabelecimento do adquirente","Venda de produção do estabelecimento remetida para industria","Classificam-se neste código as vendas de produtos industrializados no estabelecimento, remetidos para serem industrializados em outro estabelecimento, por conta e ordem do adquirente, sem que os produtos tenham transitado pelo estabelecimento do adquirente.","output","cfop_5100","normal",1
"cfop_5123","5123","Venda de mercadoria adquirida ou recebida de terceiros remetida para industrialização, por conta e ordem do adquirente, sem transitar pelo estabelecimento do adquirente","Venda de mercadoria adquirida ou recebida de terceiros remet","Classificam-se neste código as vendas de mercadorias adquiridas ou recebidas de terceiros, que não tenham sido objeto de qualquer processo industrial no estabelecimento, remetidas para serem industrializadas em outro estabelecimento, por conta e ordem do adquirente, sem que as mercadorias tenham transitado pelo estabelecimento do adquirente.","output","cfop_5100","normal",1
"cfop_5122","5122","Venda de produção do estabelecimento remetida para industrialização, por conta e ordem do adquirente, sem transitar pelo estabelecimento do adquirente","Venda de produção do estabelecimento remetida","Venda de produção do estabelecimento remetida para industrialização, por conta e ordem do adquirente, sem transitar pelo estabelecimento do adquirente","output","cfop_5100","normal",1
"cfop_5124","5124","Industrialização efetuada para outra empresa","Industrialização efetuada para outra empresa","Classificam-se neste código as saídas de mercadorias industrializadas para terceiros, compreendendo os valores referentes aos serviços prestados e os das mercadorias de propriedade do industrializador empregadas no processo industrial.","output","cfop_5100","normal",1
"cfop_5125","5125","Industrialização efetuada para outra empresa quando a mercadoria recebida para utilização no processo de industrialização não transitar pelo estabelecimento adquirente da mercadoria","Industrialização efetuada para outra empresa quando a mercad","Classificam-se neste código as saídas de mercadorias industrializadas para outras empresas, em que as mercadorias recebidas para utilização no processo de industrialização não tenham transitado pelo estabelecimento do adquirente das mercadorias, compreendendo os valores referentes aos serviços prestados e os das mercadorias de propriedade do industrializador empregadas no processo industrial.","output","cfop_5100","normal",1
"cfop_5129","5129","Venda de insumo importado e de mercadoria industrializada sob o amparo do Regime Aduaneiro especial de Entreposto Industrial (Recof-Sped)","Venda de insumo importado (Recof-Sped)","Classificam-se neste código as vendas de insumo importado e de mercadoria industrializada sob o amparo do Regime Aduaneiro especial de Entreposto Industrial (Recof-Sped).","output","cfop_5100","normal",1
"cfop_5150","5150","TRANSFERÊNCIAS DE PRODUÇÃO PRÓPRIA OU DE TERCEIROS","TRANSFERÊNCIAS DE PRODUÇÃO PRÓPRIA OU DE TERCEIROS",,"output","cfop_5000","view",1
"cfop_5151","5151","Transferência de produção do estabelecimento","Transferência de produção do estabelecimento","Classificam-se neste código os produtos industrializados ou produzidos pelo estabelecimento em transferência para outro estabelecimento da mesma empresa.","output","cfop_5150","normal",1
"cfop_5152","5152","Transferência de mercadoria adquirida ou recebida de terceiros","Transferência de mercadoria adquirida ou recebida de terceir","Classificam-se neste código as mercadorias adquiridas ou recebidas de terceiros para industrialização, comercialização ou para utilização na prestação de serviços e que não tenham sido objeto de qualquer processo industrial no estabelecimento, transferidas para outro estabelecimento da mesma empresa.","output","cfop_5150","normal",1
"cfop_5153","5153","Transferência de energia elétrica","Transferência de energia elétrica","Classificam-se neste código as transferências de energia elétrica para outro estabelecimento da mesma empresa, para distribuição.","output","cfop_5150","normal",1
"cfop_5155","5155","Transferência de produção do estabelecimento, que não deva por ele transitar","Transferência de produção do estabelecimento, que não deva p","Classificam-se neste código as transferências para outro estabelecimento da mesma empresa, de produtos industrializados no estabelecimento que tenham sido remetidos para armazém geral, depósito fechado ou outro, sem que haja retorno ao estabelecimento depositante.","output","cfop_5150","normal",1
"cfop_5156","5156","Transferência de mercadoria adquirida ou recebida de terceiros, que não deva por ele transitar","Transferência de mercadoria adquirida ou recebida de terceir","Classificam-se neste código as transferências para outro estabelecimento da mesma empresa, de mercadorias adquiridas ou recebidas de terceiros para industrialização ou comercialização, que não tenham sido objeto de qualquer processo industrial, remetidas para armazém geral, depósito fechado ou outro, sem que haja retorno ao estabelecimento depositante.","output","cfop_5150","normal",1
"cfop_5200","5200","DEVOLUÇÕES DE COMPRAS PARA INDUSTRIALIZAÇÃO, PRODUÇÃO RURAL, COMERCIALIZAÇÃO OU ANULAÇÕES DE VALORES","DEVOLUÇÕES DE COMPRAS PARA INDUSTRIALIZAÇÃO, PRODUÇÃO RURAL,",,"output","cfop_5000","view",1
"cfop_5201","5201","Devolução de compra para industrialização ou produção rural","Devolução de compra para industrialização ou produção rural","Classificam-se neste código as devoluções de mercadorias adquiridas para serem utilizadas em processo de industrialização ou produção rural, cujas entradas tenham sido classificadas como 1.101 - Compra para industrialização ou produção rural.","output","cfop_5200","normal",1
"cfop_5202","5202","Devolução de compra para comercialização","Devolução de compra para comercialização","Classificam-se neste código as devoluções de mercadorias adquiridas para serem comercializadas, cujas entradas tenham sido classificadas como Compra para comercialização.","output","cfop_5200","normal",1
"cfop_5205","5205","Anulação de valor relativo a aquisição de serviço de comunicação","Anulação de valor relativo a aquisição de serviço de comunic","Classificam-se neste código as anulações correspondentes a valores faturados indevidamente, decorrentes das aquisições de serviços de comunicação.","output","cfop_5200","normal",1
"cfop_5206","5206","Anulação de valor relativo a aquisição de serviço de transporte","Anulação de valor relativo a aquisição de serviço de transpo","Classificam-se neste código as anulações correspondentes a valores faturados indevidamente, decorrentes das aquisições de serviços de transporte.","output","cfop_5200","normal",1
"cfop_5207","5207","Anulação de valor relativo à compra de energia elétrica","Anulação de valor relativo à compra de energia elétrica","Classificam-se neste código as anulações correspondentes a valores faturados indevidamente, decorrentes da compra de energia elétrica.","output","cfop_5200","normal",1
"cfop_5208","5208","Devolução de mercadoria recebida em transferência para industrialização ou produção rural","Devolução de mercadoria recebida em transferência para indus","Classificam-se neste código as devoluções de mercadorias recebidas em transferência de outros estabelecimentos da mesma empresa, para serem utilizadas em processo de industrialização ou produção rural.","output","cfop_5200","normal",1
"cfop_5209","5209","Devolução de mercadoria recebida em transferência para comercialização","Devolução de mercadoria recebida em transferência para comer","Classificam-se neste código as devoluções de mercadorias recebidas em transferência de outro estabelecimento da mesma empresa, para serem comercializadas.","output","cfop_5200","normal",1
"cfop_5210","5210","Devolução de compra para utilização na prestação de serviço","Devolução de compra para utilização na prestação de serviço","Classificam-se neste código as devoluções de mercadorias adquiridas para utilização na prestação de serviços, cujas entradas tenham sido classificadas no código 1.126 - Compra para utilização na prestação de serviço.","output","cfop_5200","normal",1
"cfop_5250","5250","VENDAS DE ENERGIA ELÉTRICA","VENDAS DE ENERGIA ELÉTRICA",,"output","cfop_5000","view",1
"cfop_5251","5251","Venda de energia elétrica para distribuição ou comercialização","Venda de energia elétrica para distribuição ou comercializaç","Classificam-se neste código as vendas de energia elétrica destinada à distribuição ou comercialização. Também serão classificadas neste código as vendas de energia elétrica destinada a cooperativas para distribuição aos seus cooperados.","output","cfop_5250","normal",1
