"id","code","name","small_name","description","type","parent_id:id","internal_type"
"cfop_408","5914","Remessa de mercadoria ou bem para exposição ou feira","Remessa de mercadoria ou bem para exposição ou feira","Classificam-se neste código as remessas de mercadorias ou bens para exposição ou feira.","output","cfop_394","normal"
"cfop_409","5915","Remessa de mercadoria ou bem para conserto ou reparo","Remessa de mercadoria ou bem para conserto ou reparo","Classificam-se neste código as remessas de mercadorias ou bens para conserto ou reparo.","output","cfop_394","normal"
"cfop_410","5916","Retorno de mercadoria ou bem recebido para conserto ou reparo","Retorno de mercadoria ou bem recebido para conserto ou repar","Classificam-se neste código as remessas em devolução de mercadorias ou bens recebidos para conserto ou reparo.","output","cfop_394","normal"
"cfop_411","5917","Remessa de mercadoria em consignação mercantil ou industrial","Remessa de mercadoria em consignação mercantil ou industrial","Classificam-se neste código as remessas de mercadorias a título de consignação mercantil ou industrial.","output","cfop_394","normal"
"cfop_412","5918","Devolução de mercadoria recebida em consignação mercantil ou industrial","Devolução de mercadoria recebida em consignação mercantil ou","Classificam-se neste código as devoluções de mercadorias recebidas anteriormente a título de consignação mercantil ou industrial.","output","cfop_394","normal"
"cfop_413","5919","Devolução simbólica de mercadoria vendida ou utilizada em processo industrial, recebida anteriormente em consignação mercantil ou industrial","Devolução simbólica de mercadoria vendida ou utilizada em pr","Classificam-se neste código as devoluções simbólicas de mercadorias vendidas ou utilizadas em processo industrial, que tenham sido recebidas anteriormente a título de consignação mercantil ou industrial.","output","cfop_394","normal"
"cfop_414","5920","Remessa de vasilhame ou sacaria","Remessa de vasilhame ou sacaria","Classificam-se neste código as remessas de vasilhame ou sacaria.","output","cfop_394","normal"
"cfop_415","5921","Devolução de vasilhame ou sacaria","Devolução de vasilhame ou sacaria","Classificam-se neste código as saídas por devolução de vasilhame ou sacaria.","output","cfop_394","normal"
"cfop_416","5922","Lançamento efetuado a título de simples faturamento decorrente de venda para entrega futura","Lançamento efetuado a título de simples faturamento decorren","Classificam-se neste código os registros efetuados a título de simples faturamento decorrente de venda para entrega futura.","output","cfop_394","normal"
"cfop_417","5923","Remessa de mercadoria por conta e ordem de terceiros, em venda à ordem","Remessa de mercadoria por conta e ordem de terceiros, em ven","Classificam-se neste código as saídas correspondentes à entrega de mercadorias por conta e ordem de terceiros, em vendas à ordem, cuja venda ao adquirente originário, foi classificada nos códigos 5.118 - Venda de produção do estabelecimento entregue ao destinatário por conta e ordem do adquirente originário, em venda à ordem ou 5.119 - Venda de mercadoria adquirida ou recebida de terceiros entregue ao destinatário por conta e ordem do adquirente originário, em venda à ordem.","output","cfop_394","normal"
"cfop_418","5924","Remessa para industrialização por conta e ordem do adquirente da mercadoria, quando esta não transitar pelo estabelecimento do adquirente","Remessa para industrialização por conta e ordem do adquirent","Classificam-se neste código as saídas de insumos com destino a estabelecimento industrializador, para serem industrializados por conta e ordem do adquirente, nas hipóteses em que os insumos não tenham transitado pelo estabelecimento do adquirente dos mesmos.","output","cfop_394","normal"
"cfop_419","5925","Retorno de mercadoria recebida para industrialização por conta e ordem do adquirente da mercadoria, quando aquela não transitar pelo estabelecimento do adquirente","Retorno de mercadoria recebida para industrialização por con","Classificam-se neste código as remessas, pelo estabelecimento industrializador, dos insumos recebidos, por conta e ordem do adquirente, para industrialização e incorporados ao produto final, nas hipóteses em que os insumos não tenham transitado pelo estabelecimento do adquirente. O valor dos insumos nesta operação deverá ser igual ao valor dos insumos recebidos para industrialização.","output","cfop_394","normal"
"cfop_420","5926","Lançamento efetuado a título de reclassificação de mercadoria decorrente de formação de kit ou de sua desagregação","Lançamento efetuado a título de reclassificação de mercadori","Classificam-se neste código os registros efetuados a título de reclassificação decorrente de formação de kit de mercadorias ou de sua desagregação.","output","cfop_394","normal"
"cfop_421","5927","Lançamento efetuado a título de baixa de estoque decorrente de perda, roubo ou deterioração","Lançamento efetuado a título de baixa de estoque decorrente ","Classificam-se neste código os registros efetuados a título de baixa de estoque decorrente de perda, roubou ou deterioração das mercadorias.","output","cfop_394","normal"
"cfop_422","5928","Lançamento efetuado a título de baixa de estoque decorrente do encerramento da atividade da empresa","Lançamento efetuado a título de baixa de estoque decorrente ","Classificam-se neste código os registros efetuados a título de baixa de estoque decorrente do encerramento das atividades da empresa.","output","cfop_394","normal"
"cfop_423","5929","Lançamento efetuado em decorrência de emissão de documento fiscal relativo a operação ou prestação também registrada em equipamento Emissor de Cupom Fiscal - ECF","Lançamento efetuado em decorrência de emissão de documento f","Classificam-se neste código os registros relativos aos documentos fiscais emitidos em operações ou prestações que também tenham sido registradas em equipamento Emissor de Cupom Fiscal - ECF.","output","cfop_394","normal"
"cfop_424","5931","Lanç. efetuado pelo tomador do serviço de transporte quando a resp. de retenção do imposto for atribuída ao remetente ou alienante da merc., pelo serviço de transp. realizado por transp. autônomo ou por transp. não inscrito na UF onde iniciado o serviço","Lanç. efetuado pelo tomador do serviço de transporte quando ","Classificam-se neste código exclusivamente os lançamentos efetuados pelo remetente ou alienante da mercadoria quando lhe for atribuída a responsabilidade pelo recolhimento do imposto devido pelo serviço de transporte realizado por transportador autônomo ou por transportador não inscrito na unidade da Federação onde iniciado o serviço.","output","cfop_394","normal"
"cfop_425","5932","Prestação de serviço de transporte iniciada em unidade da Federação diversa daquela onde inscrito o prestador","Prestação de serviço de transporte iniciada em unidade da Fe","Classificam-se neste código as prestações de serviço de transporte que tenham sido iniciadas em unidade da Federação diversa daquela onde o prestador está inscrito como contribuinte.","output","cfop_394","normal"
"cfop_426","5933","Prestação de serviço tributado pelo ISSQN","Prestação de serviço tributado pelo ISSQN","Classificam-se neste código as prestações de serviços, de competência municipal, desde que informados em Nota Fiscal modelo 1 ou 1-A.","output","cfop_394","normal"
"cfop_427","5949","Outra saída de mercadoria ou prestação de serviço não especificado","Outra saída de mercadoria ou prestação de serviço não especi","Classificam-se neste código as outras saídas de mercadorias ou prestações de serviços que não tenham sido especificados nos códigos anteriores.","output","cfop_394","normal"
"cfop_428","6000","SAÍDAS OU PRESTAÇÕES DE SERVIÇOS PARA OUTROS ESTADOS","SAÍDAS OU PRESTAÇÕES DE SERVIÇOS PARA OUTROS ESTADOS",,"output",,"view"
"cfop_429","6100","VENDAS DE PRODUÇÃO PRÓPRIA OU DE TERCEIROS","VENDAS DE PRODUÇÃO PRÓPRIA OU DE TERCEIROS",,"output","cfop_428","view"
"cfop_430","6101","Venda de produção do estabelecimento","Venda de produção do estabelecimento","Classificam-se neste código as vendas de produtos industrializados ou produzidos pelo próprio estabelecimento. Também serão classificadas neste código as vendas de mercadorias por estabelecimento industrial ou produtor rural de cooperativa destinadas a seus cooperados ou a estabelecimento de outra cooperativa.","output","cfop_429","normal"
"cfop_431","6102","Venda de mercadoria adquirida ou recebida de terceiros","Venda de mercadoria adquirida ou recebida de terceiros","Classificam-se neste código as vendas de mercadorias adquiridas ou recebidas de terceiros para industrialização ou comercialização, que não tenham sido objeto de qualquer processo industrial no estabelecimento. Também serão classificadas neste código as vendas de mercadorias por estabelecimento comercial de cooperativa destinadas a seus cooperados ou estabelecimento de outra cooperativa.","output","cfop_429","normal"
"cfop_432","6103","Venda de produção do estabelecimento, efetuada fora do estabelecimento","Venda de produção do estabelecimento, efetuada fora do estab","Classificam-se neste código as vendas efetuadas fora do estabelecimento, inclusive por meio de veículo, de produtos industrializados ou produzidos pelo próprio estabelecimento.","output","cfop_429","normal"
"cfop_433","6104","Venda de mercadoria adquirida ou recebida de terceiros, efetuada fora do estabelecimento","Venda de mercadoria adquirida ou recebida de terceiros, efet","Classificam-se neste código as vendas efetuadas fora do estabelecimento, inclusive por meio de veículo, de mercadorias adquiridas ou recebidas de terceiros para industrialização ou comercialização, que não tenham sido objeto de qualquer processo industrial no estabelecimento.","output","cfop_429","normal"
"cfop_434","6105","Venda de produção do estabelecimento que não deva por ele transitar","Venda de produção do estabelecimento que não deva por ele tr","Classificam-se neste código as vendas de produtos industrializados no estabelecimento, armazenados em depósito fechado, armazém geral ou outro sem que haja retorno ao estabelecimento depositante.","output","cfop_429","normal"
"cfop_435","6106","Venda de mercadoria adquirida ou recebida de terceiros, que não deva por ele transitar","Venda de mercadoria adquirida ou recebida de terceiros, que ","Classificam-se neste código as vendas de mercadorias adquiridas ou recebidas de terceiros para industrialização ou comercialização, armazenadas em depósito fechado, armazém geral ou outro, que não tenham sido objeto de qualquer processo industrial no estabelecimento sem que haja retorno ao estabelecimento depositante. Também serão classificadas neste código as vendas de mercadorias importadas, cuja saída ocorra do recinto alfandegado ou da repartição alfandegária onde se processou o desembaraço aduaneiro, com destino ao estabelecimento do comprador, sem transitar pelo estabelecimento do importador.","output","cfop_429","normal"
"cfop_436","6107","Venda de produção do estabelecimento, destinada a não contribuinte","Venda de produção do estabelecimento, destinada a não contri","Classificam-se neste código as vendas de produtos industrializados ou produzidos por estabelecimento de produtor rural, destinadas a não contribuintes. Quaisquer operações de venda destinadas a não contribuintes deverão ser classificadas neste código.","output","cfop_429","normal"
"cfop_437","6108","Venda de mercadoria adquirida ou recebida de terceiros, destinada a não contribuinte","Venda de mercadoria adquirida ou recebida de terceiros, dest","Classificam-se neste código as vendas de mercadorias adquiridas ou recebidas de terceiros para industrialização ou comercialização, que não tenham sido objeto de qualquer processo industrial no estabelecimento, destinadas a não contribuintes. Quaisquer operações de venda destinadas a não contribuintes deverão ser classificadas neste código.","output","cfop_429","normal"
"cfop_438","6109","Venda de produção do estabelecimento, destinada à Zona Franca de Manaus ou Áreas de Livre Comércio","Venda de produção do estabelecimento, destinada à Zona Franc","Classificam-se neste código as vendas de produtos industrializados ou produzido pelo próprio estabelecimento, destinados à Zona Franca de Manaus ou Áreas de Livre Comércio.","output","cfop_429","normal"
"cfop_439","6110","Venda de mercadoria adquirida ou recebida de terceiros, destinada à Zona Franca de Manaus ou Áreas de Livre Comércio","Venda de mercadoria adquirida ou recebida de terceiros, dest","Classificam-se neste código as vendas de mercadorias adquiridas ou recebidas de terceiros, destinadas à Zona Franca de Manaus ou Áreas de Livre Comércio, desde que alcançadas pelos benefícios fiscais de que tratam o Decreto-lei n° 288, de 28 de fevereiro de 1967, o Convênio ICM 65/88, de 6 de dezembro de 1988, o Convênio ICMS 36/97, de 23 de maio de 1997 e o Convênio ICMS 37/97, de 23 de maio de 1997.","output","cfop_429","normal"
"cfop_440","6111","Venda de produção do estabelecimento remetida anteriormente em consignação industrial","Venda de produção do estabelecimento remetida anteriormente ","Classificam-se neste código as vendas efetivas de produtos industrializados no estabelecimento remetidos anteriormente a título de consignação industrial.","output","cfop_429","normal"
"cfop_441","6112","Venda de mercadoria adquirida ou recebida de Terceiros remetida anteriormente em consignação industrial","Venda de mercadoria adquirida ou recebida de Terceiros remet","Classificam-se neste código as vendas efetivas de mercadorias adquiridas ou recebidas de terceiros, que não tenham sido objeto de qualquer processo industrial no estabelecimento, remetidas anteriormente a título de consignação industrial.","output","cfop_429","normal"
"cfop_442","6113","Venda de produção do estabelecimento remetida anteriormente em consignação mercantil","Venda de produção do estabelecimento remetida anteriormente ","Classificam-se neste código as vendas efetivas de produtos industrializados no estabelecimento remetidos anteriormente a título de consignação mercantil.","output","cfop_429","normal"
"cfop_443","6114","Venda de mercadoria adquirida ou recebida de terceiros remetida anteriormente em consignação mercantil","Venda de mercadoria adquirida ou recebida de terceiros remet","Classificam-se neste código as vendas efetivas de mercadorias adquiridas ou recebidas de terceiros, que não tenham sido objeto de qualquer processo industrial no estabelecimento, remetidas anteriormente a título de consignação mercantil.","output","cfop_429","normal"
"cfop_444","6115","Venda de mercadoria adquirida ou recebida de terceiros, recebida anteriormente em consignação mercantil","Venda de mercadoria adquirida ou recebida de terceiros, rece","Classificam-se neste código as vendas de mercadorias adquiridas ou recebidas de terceiros, recebidas anteriormente a título de consignação mercantil.","output","cfop_429","normal"
"cfop_445","6116","Venda de produção do estabelecimento originada de encomenda para entrega futura","Venda de produção do estabelecimento originada de encomenda ","Classificam-se neste código as vendas de produtos industrializados ou produzido pelo próprio estabelecimento, quando da saída real do produto, cujo faturamento tenha sido classificado no código 6.922  Lançamento efetuado a título de simples faturamento decorrente de venda para entrega futura.","output","cfop_429","normal"
"cfop_446","6117","Venda de mercadoria adquirida ou recebida de terceiros, originada de encomenda para entrega futura","Venda de mercadoria adquirida ou recebida de terceiros, orig","Classificam-se neste código as vendas de mercadorias adquiridas ou recebidas de terceiros, que não tenham sido objeto de qualquer processo industrial no estabelecimento, quando da saída real da mercadoria, cujo faturamento tenha sido classificado no código 6.922 - Lançamento efetuado a título de simples faturamento decorrente de venda para entrega futura.","output","cfop_429","normal"
"cfop_447","6118","Venda de produção do estabelecimento entregue ao destinatário por conta e ordem do adquirente originário, em venda à ordem","Venda de produção do estabelecimento entregue ao destinatári","Classificam-se neste código as vendas à ordem de produtos industrializados pelo estabelecimento, entregues ao destinatário por conta e ordem do adquirente originário.","output","cfop_429","normal"
"cfop_448","6119","Venda de mercadoria adquirida ou recebida de terceiros entregue ao destinatário por conta e ordem do adquirente originário, em venda à ordem","Venda de mercadoria adquirida ou recebida de terceiros entre","Classificam-se neste código as vendas à ordem de mercadorias adquiridas ou recebidas de terceiros, que não tenham sido objeto de qualquer processo industrial no estabelecimento, entregues ao destinatário por conta e ordem do adquirente originário.","output","cfop_429","normal"
"cfop_449","6120","Venda de mercadoria adquirida ou recebida de terceiros entregue ao destinatário pelo vendedor remetente, em venda à ordem","Venda de mercadoria adquirida ou recebida de terceiros entre","Classificam-se neste código as vendas à ordem de mercadorias adquiridas ou recebidas de terceiros, que não tenham sido objeto de qualquer processo industrial no estabelecimento, entregues pelo vendedor remetente ao destinatário, cuja compra seja classificada, pelo adquirente originário, no código 2.118 - Compra de mercadoria pelo adquirente originário, entregue pelo vendedor remetente ao destinatário, em venda à ordem.","output","cfop_429","normal"
"cfop_450","6122","Venda de produção do estabelecimento remetida para industrialização, por conta e ordem do adquirente, sem transitar pelo estabelecimento do adquirente","Venda de produção do estabelecimento remetida para industria","Classificam-se neste código as vendas de produtos industrializados no estabelecimento, remetidos para serem industrializados em outro estabelecimento, por conta e ordem do adquirente, sem que os produtos tenham transitado pelo estabelecimento do adquirente.","output","cfop_429","normal"
"cfop_451","6123","Venda de mercadoria adquirida ou recebida de terceiros remetida para industrialização, por conta e ordem do adquirente, sem transitar pelo estabelecimento do adquirente","Venda de mercadoria adquirida ou recebida de terceiros remet","Classificam-se neste código as vendas de mercadorias adquiridas ou recebidas de terceiros, que não tenham sido objeto de qualquer processo industrial no estabelecimento, remetidas para serem industrializadas em outro estabelecimento, por conta e ordem do adquirente, sem que as mercadorias tenham transitado pelo estabelecimento do adquirente.","output","cfop_429","normal"
"cfop_452","6124","Industrialização efetuada para outra empresa","Industrialização efetuada para outra empresa","Classificam-se neste código as saídas de mercadorias industrializadas para terceiros, compreendendo os valores referentes aos serviços prestados e os das mercadorias de propriedade do industrializador empregadas no processo industrial.","output","cfop_429","normal"
"cfop_453","6125","Industrialização efetuada para outra empresa quando a mercadoria recebida para utilização no processo de industrialização não transitar pelo estabelecimento adquirente da mercadoria","Industrialização efetuada para outra empresa quando a mercad","Classificam-se neste código as saídas de mercadorias industrializadas para outras empresas, em que as mercadorias recebidas para utilização no processo de industrialização não tenham transitado pelo estabelecimento do adquirente das mercadorias, compreendendo os valores referentes aos serviços prestados e os das mercadorias de propriedade do industrializador empregadas no processo industrial.","output","cfop_429","normal"
"cfop_454","6150","TRANSFERÊNCIAS DE PRODUÇÃO PRÓPRIA OU DE TERCEIROS","TRANSFERÊNCIAS DE PRODUÇÃO PRÓPRIA OU DE TERCEIROS",,"output","cfop_428","view"
"cfop_455","6151","Transferência de produção do estabelecimento","Transferência de produção do estabelecimento","Classificam-se neste código os produtos industrializados ou produzidos pelo estabelecimento em transferência para outro estabelecimento da mesma empresa.","output","cfop_454","normal"
"cfop_456","6152","Transferência de mercadoria adquirida ou recebida de terceiros","Transferência de mercadoria adquirida ou recebida de terceir","Classificam-se neste código as mercadorias adquiridas ou recebidas de terceiros para industrialização, comercialização ou para utilização na prestação de serviços e que não tenham sido objeto de qualquer processo industrial no estabelecimento, transferidas para outro estabelecimento da mesma empresa.","output","cfop_454","normal"
"cfop_457","6153","Transferência de energia elétrica","Transferência de energia elétrica","Classificam-se neste código as transferências de energia elétrica para outro estabelecimento da mesma empresa, para distribuição.","output","cfop_454","normal"
"cfop_458","6155","Transferência de produção do estabelecimento, que não deva por ele transitar","Transferência de produção do estabelecimento, que não deva p","Classificam-se neste código as transferências para outro estabelecimento da mesma empresa, de produtos industrializados no estabelecimento que tenham sido remetidos para armazém geral, depósito fechado ou outro, sem que haja retorno ao estabelecimento depositante.","output","cfop_454","normal"
"cfop_459","6156","Transferência de mercadoria adquirida ou recebida de terceiros, que não deva por ele transitar","Transferência de mercadoria adquirida ou recebida de terceir","Classificam-se neste código as transferências para outro estabelecimento da mesma empresa, de mercadorias adquiridas ou recebidas de terceiros para industrialização ou comercialização, que não tenham sido objeto de qualquer processo industrial, remetidas para armazém geral, depósito fechado ou outro, sem que haja retorno ao estabelecimento depositante.","output","cfop_454","normal"
"cfop_460","6200","DEVOLUÇÕES DE COMPRAS PARA INDUSTRIALIZAÇÃO, PRODUÇÃO RURAL, COMERCIALIZAÇÃO OU ANULAÇÕES DE VALORES","DEVOLUÇÕES DE COMPRAS PARA INDUSTRIALIZAÇÃO, PRODUÇÃO RURAL,",,"output","cfop_428","view"
"cfop_461","6201","Devolução de compra para industrialização ou produção rural","Devolução de compra para industrialização ou produção rural","Classificam-se neste código as devoluções de mercadorias adquiridas para serem utilizadas em processo de industrialização ou produção rural, cujas entradas tenham sido classificadas como 2.201 - Compra para industrialização ou produção rural.","output","cfop_460","normal"
"cfop_462","6202","Devolução de compra para comercialização","Devolução de compra para comercialização","Classificam-se neste código as devoluções de mercadorias adquiridas para serem comercializadas, cujas entradas tenham sido classificadas como Compra para comercialização.","output","cfop_460","normal"
"cfop_463","6205","Anulação de valor relativo a aquisição de serviço de comunicação","Anulação de valor relativo a aquisição de serviço de comunic","Classificam-se neste código as anulações correspondentes a valores faturados indevidamente, decorrentes das aquisições de serviços de comunicação.","output","cfop_460","normal"
"cfop_464","6206","Anulação de valor relativo a aquisição de serviço de transporte","Anulação de valor relativo a aquisição de serviço de transpo","Classificam-se neste código as anulações correspondentes a valores faturados indevidamente, decorrentes das aquisições de serviços de transporte.","output","cfop_460","normal"
"cfop_465","6207","Anulação de valor relativo à compra de energia elétrica","Anulação de valor relativo à compra de energia elétrica","Classificam-se neste código as anulações correspondentes a valores faturados indevidamente, decorrentes da compra de energia elétrica.","output","cfop_460","normal"
"cfop_466","6208","Devolução de mercadoria recebida em transferência para industrialização ou produção rural","Devolução de mercadoria recebida em transferência para indus","Classificam-se neste código as devoluções de mercadorias recebidas em transferência de outros estabelecimentos da mesma empresa, para serem utilizadas em processo de industrialização ou produção rural.","output","cfop_460","normal"
"cfop_467","6209","Devolução de mercadoria recebida em transferência para comercialização","Devolução de mercadoria recebida em transferência para comer","Classificam-se neste código as devoluções de mercadorias recebidas em transferência de outro estabelecimento da mesma empresa, para serem comercializadas.","output","cfop_460","normal"
"cfop_468","6210","Devolução de compra para utilização na prestação de serviço","Devolução de compra para utilização na prestação de serviço","Classificam-se neste código as devoluções de mercadorias adquiridas para utilização na prestação de serviços, cujas entradas tenham sido classificadas no código 2.126 - Compra para utilização na prestação de serviço.","output","cfop_460","normal"
"cfop_469","6250","VENDAS DE ENERGIA ELÉTRICA","VENDAS DE ENERGIA ELÉTRICA",,"output","cfop_428","view"
