"id","code","name","small_name","description","type","parent_id:id","internal_type"
"cfop_134","2125","Industrialização efetuada por outra empresa quando a mercadoria remetida para utilização no processo de industrialização não transitou pelo estabelecimento adquirente da mercadoria","Industrialização efetuada por outra empresa quando a mercado","Classificam-se neste código as entradas de mercadorias industrializadas por outras empresas, em que as mercadorias remetidas para utilização no processo de industrialização não transitaram pelo estabelecimento do adquirente das mercadorias, compreendendo os valores referentes aos serviços prestados e os das mercadorias de propriedade do industrializador empregadas no processo industrial. Quando a industrialização efetuada se referir a bens do ativo imobilizado ou de mercadorias para uso ou consumo do estabelecimento encomendante, a entrada deverá ser classificada nos códigos 2.551 - Compra de bem para o ativo imobilizado ou 2.556 - Compra de material para uso ou consumo.","input","cfop_122","normal"
"cfop_135","2126","Compra para utilização na prestação de serviço","Compra para utilização na prestação de serviço","Classificam-se neste código as entradas de mercadorias a serem utilizadas nas prestações de serviços.","input","cfop_122","normal"
"cfop_136","2150","TRANSFERÊNCIAS PARA INDUSTRIALIZAÇÃO, PRODUÇÃO RURAL, COMERCIALIZAÇÃO OU PRESTAÇÃO DE SERVIÇOS","TRANSFERÊNCIAS PARA INDUSTRIALIZAÇÃO, PRODUÇÃO RURAL, COMERC",,"input","cfop_121","view"
"cfop_137","2151","Transferência para industrialização ou produção rural","Transferência para industrialização ou produção rural","Classificam-se neste código as entradas de mercadorias recebidas em transferência de outro estabelecimento da mesma empresa, para serem utilizadas em processo de industrialização ou produção rural.","input","cfop_136","normal"
"cfop_138","2152","Transferência para comercialização","Transferência para comercialização","Classificam-se neste código as entradas de mercadorias recebidas em transferência de outro estabelecimento da mesma empresa, para serem comercializadas.","input","cfop_136","normal"
"cfop_139","2153","Transferência de energia elétrica para distribuição","Transferência de energia elétrica para distribuição","Classificam-se neste código as entradas de energia elétrica recebida em transferência de outro estabelecimento da mesma empresa, para distribuição.","input","cfop_136","normal"
"cfop_140","2154","Transferência para utilização na prestação de serviço","Transferência para utilização na prestação de serviço","Classificam-se neste código as entradas de mercadorias recebidas em transferência de outro estabelecimento da mesma empresa, para serem utilizadas nas prestações de serviços.","input","cfop_136","normal"
"cfop_141","2200","DEVOLUÇÕES DE VENDAS DE PRODUÇÃO PRÓPRIA, DE TERCEIROS OU ANULAÇÕES DE VALORES","DEVOLUÇÕES DE VENDAS DE PRODUÇÃO PRÓPRIA, DE TERCEIROS OU AN",,"input","cfop_121","view"
"cfop_142","2201","Devolução de venda de produção do estabelecimento","Devolução de venda de produção do estabelecimento","Classificam-se neste código as devoluções de vendas de produtos industrializados ou produzidos pelo próprio estabelecimento, cujas saídas tenham sido classificadas como 6.101 - Venda de produção do estabelecimento.","input","cfop_141","normal"
"cfop_143","2202","Devolução de venda de mercadoria adquirida ou recebida de terceiros","Devolução de venda de mercadoria adquirida ou recebida de te","Classificam-se neste código as devoluções de vendas de mercadorias adquiridas ou recebidas de terceiros, que não tenham sido objeto de industrialização no estabelecimento, cujas saídas tenham sido classificadas como Venda de mercadoria adquirida ou recebida de terceiros.","input","cfop_141","normal"
"cfop_144","2203","Devolução de venda de produção do estabelecimento, destinada à Zona Franca de Manaus ou Áreas de Livre Comércio","Devolução de venda de produção do estabelecimento, destinada","Classificam-se neste código as devoluções de vendas de produtos industrializados ou produzidos pelo próprio estabelecimento, cujas saídas foram classificadas no código 6.109  Venda de produção do estabelecimento, destinada à Zona Franca de Manaus ou Áreas de Livre Comércio.","input","cfop_141","normal"
"cfop_145","2204","Devolução de venda de mercadoria adquirida ou recebida de terceiros, destinada à Zona Franca de Manaus ou Áreas de Livre Comércio","Devolução de venda de mercadoria adquirida ou recebida de te","Classificam-se neste código as devoluções de vendas de mercadorias adquiridas ou recebidas de terceiros, cujas saídas foram classificadas no código 6.110 - Venda de mercadoria adquirida ou recebida de terceiros, destinada à Zona Franca de Manaus ou Áreas de Livre Comércio.","input","cfop_141","normal"
"cfop_146","2205","Anulação de valor relativo à prestação de serviço de comunicação","Anulação de valor relativo à prestação de serviço de comunic","Classificam-se neste código as anulações correspondentes a valores faturados indevidamente, decorrentes de prestações de serviços de comunicação.","input","cfop_141","normal"
"cfop_147","2206","Anulação de valor relativo à prestação de serviço de transporte","Anulação de valor relativo à prestação de serviço de transpo","Classificam-se neste código as anulações correspondentes a valores faturados indevidamente, decorrentes de prestações de serviços de transporte.","input","cfop_141","normal"
"cfop_148","2207","Anulação de valor relativo à venda de energia elétrica","Anulação de valor relativo à venda de energia elétrica","Classificam-se neste código as anulações correspondentes a valores faturados indevidamente, decorrentes de venda de energia elétrica.","input","cfop_141","normal"
"cfop_149","2208","Devolução de produção do estabelecimento, remetida em transferência","Devolução de produção do estabelecimento, remetida em transf","Classificam-se neste código as devoluções de produtos industrializados ou produzidos pelo próprio estabelecimento, transferidos para outros estabelecimentos da mesma empresa.","input","cfop_141","normal"
"cfop_150","2209","Devolução de mercadoria adquirida ou recebida de terceiros, remetida em transferência","Devolução de mercadoria adquirida ou recebida de terceiros, ","Classificam-se neste código as devoluções de mercadorias adquiridas ou recebidas de terceiros, transferidas para outros estabelecimentos da mesma empresa.","input","cfop_141","normal"
"cfop_151","2250","COMPRAS DE ENERGIA ELÉTRICA","COMPRAS DE ENERGIA ELÉTRICA",,"input","cfop_121","view"
"cfop_152","2251","Compra de energia elétrica para distribuição ou comercialização","Compra de energia elétrica para distribuição ou comercializa","Classificam-se neste código as compras de energia elétrica utilizada em sistema de distribuição ou comercialização. Também serão classificadas neste código as compras de energia elétrica por cooperativas para distribuição aos seus cooperados.","input","cfop_151","normal"
"cfop_153","2252","Compra de energia elétrica por estabelecimento industrial","Compra de energia elétrica por estabelecimento industrial","Classificam-se neste código as compras de energia elétrica utilizada no processo de industrialização. Também serão classificadas neste código as compras de energia elétrica utilizada por estabelecimento industrial de cooperativa.","input","cfop_151","normal"
"cfop_154","2253","Compra de energia elétrica por estabelecimento comercial","Compra de energia elétrica por estabelecimento comercial","Classificam-se neste código as compras de energia elétrica utilizada por estabelecimento comercial. Também serão classificadas neste código as compras de energia elétrica utilizada por estabelecimento comercial de cooperativa.","input","cfop_151","normal"
"cfop_155","2254","Compra de energia elétrica por estabelecimento prestador de serviço de transporte","Compra de energia elétrica por estabelecimento prestador de ","Classificam-se neste código as compras de energia elétrica utilizada por estabelecimento prestador de serviços de transporte.","input","cfop_151","normal"
"cfop_156","2255","Compra de energia elétrica por estabelecimento prestador de serviço de comunicação","Compra de energia elétrica por estabelecimento prestador de ","Classificam-se neste código as compras de energia elétrica utilizada por estabelecimento prestador de serviços de comunicação.","input","cfop_151","normal"
"cfop_157","2256","Compra de energia elétrica por estabelecimento de produtor rural","Compra de energia elétrica por estabelecimento de produtor r","Classificam-se neste código as compras de energia elétrica utilizada por estabelecimento de produtor rural.","input","cfop_151","normal"
"cfop_158","2257","Compra de energia elétrica para consumo por demanda contratada","Compra de energia elétrica para consumo por demanda contrata","Classificam-se neste código as compras de energia elétrica para consumo por demanda contratada, que prevalecerá sobre os demais códigos deste subgrupo.","input","cfop_151","normal"
"cfop_159","2300","AQUISIÇÕES DE SERVIÇOS DE COMUNICAÇÃO","AQUISIÇÕES DE SERVIÇOS DE COMUNICAÇÃO",,"input","cfop_121","view"
"cfop_160","2301","Aquisição de serviço de comunicação para execução de serviço da mesma natureza","Aquisição de serviço de comunicação para execução de serviço","Classificam-se neste código as aquisições de serviços de comunicação utilizados nas prestações de serviços da mesma natureza.","input","cfop_159","normal"
"cfop_161","2302","Aquisição de serviço de comunicação por estabelecimento industrial","Aquisição de serviço de comunicação por estabelecimento indu","Classificam-se neste código as aquisições de serviços de comunicação utilizados por estabelecimento industrial. Também serão classificadas neste código as aquisições de serviços de comunicação utilizados por estabelecimento industrial de cooperativa.","input","cfop_159","normal"
"cfop_162","2303","Aquisição de serviço de comunicação por estabelecimento comercial","Aquisição de serviço de comunicação por estabelecimento come","Classificam-se neste código as aquisições de serviços de comunicação utilizados por estabelecimento comercial. Também serão classificadas neste código as aquisições de serviços de comunicação utilizados por estabelecimento comercial de cooperativa.","input","cfop_159","normal"
"cfop_163","2304","Aquisição de serviço de comunicação por estabelecimento de prestador de serviço de transporte","Aquisição de serviço de comunicação por estabelecimento de p","Classificam-se neste código as aquisições de serviços de comunicação utilizado por estabelecimento prestador de serviço de transporte.","input","cfop_159","normal"
"cfop_164","2305","Aquisição de serviço de comunicação por estabelecimento de geradora ou de distribuidora de energia elétrica","Aquisição de serviço de comunicação por estabelecimento de g","Classificam-se neste código as aquisições de serviços de comunicação utilizados por estabelecimento de geradora ou de distribuidora de energia elétrica.","input","cfop_159","normal"
"cfop_165","2306","Aquisição de serviço de comunicação por estabelecimento de produtor rural","Aquisição de serviço de comunicação por estabelecimento de p","Classificam-se neste código as aquisições de serviços de comunicação utilizados por estabelecimento de produtor rural.","input","cfop_159","normal"
"cfop_166","2350","AQUISIÇÕES DE SERVIÇOS DE TRANSPORTE","AQUISIÇÕES DE SERVIÇOS DE TRANSPORTE",,"input","cfop_121","view"
"cfop_167","2351","Aquisição de serviço de transporte para execução de serviço da mesma natureza","Aquisição de serviço de transporte para execução de serviço ","Classificam-se neste código as aquisições de serviços de transporte utilizados nas prestações de serviços da mesma natureza.","input","cfop_166","normal"
"cfop_168","2352","Aquisição de serviço de transporte por estabelecimento industrial","Aquisição de serviço de transporte por estabelecimento indus","Classificam-se neste código as aquisições de serviços de transporte utilizados por estabelecimento industrial. Também serão classificadas neste código as aquisições de serviços de transporte utilizados por estabelecimento industrial de cooperativa.","input","cfop_166","normal"
"cfop_169","2353","Aquisição de serviço de transporte por estabelecimento comercial","Aquisição de serviço de transporte por estabelecimento comer","Classificam-se neste código as aquisições de serviços de transporte utilizados por estabelecimento comercial. Também serão classificadas neste código as aquisições de serviços de transporte utilizados por estabelecimento comercial de cooperativa.","input","cfop_166","normal"
"cfop_170","2354","Aquisição de serviço de transporte por estabelecimento de prestador de serviço de comunicação","Aquisição de serviço de transporte por estabelecimento de pr","Classificam-se neste código as aquisições de serviços de transporte utilizados por estabelecimento prestador de serviços de comunicação.","input","cfop_166","normal"
"cfop_171","2355"," Aquisição de serviço de transporte por estabelecimento de geradora ou de distribuidora de energia elétrica"," Aquisição de serviço de transporte por estabelecimento de g","Classificam-se neste código as aquisições de serviços de transporte utilizados por estabelecimento de geradora ou de distribuidora de energia elétrica.","input","cfop_166","normal"
"cfop_172","2356"," Aquisição de serviço de transporte por estabelecimento de produtor rural"," Aquisição de serviço de transporte por estabelecimento de p","Classificam-se neste código as aquisições de serviços de transporte utilizados por estabelecimento de produtor rural.","input","cfop_166","normal"
"cfop_173","2400","ENTRADAS DE MERCADORIAS SUJEITAS AO REGIME DE SUBSTITUIÇÃO TRIBUTÁRIA","ENTRADAS DE MERCADORIAS SUJEITAS AO REGIME DE SUBSTITUIÇÃO T",,"input","cfop_121","view"
"cfop_174","2401","Compra para industrialização ou produção rural em operação com mercadoria sujeita ao regime de substituição tributária","Compra para industrialização ou produção rural em operação c","Classificam-se neste código as compras de mercadorias a serem utilizadas em processo de industrialização ou produção rural, decorrentes de operações com mercadorias sujeitas ao regime de substituição tributária. Também serão classificadas neste código as compras por estabelecimento industrial ou produtor rural de cooperativa de mercadorias sujeitas ao regime de substituição tributária.","input","cfop_173","normal"
"cfop_175","2403","Compra para comercialização em operação com mercadoria sujeita ao regime de substituição tributária","Compra para comercialização em operação com mercadoria sujei","Classificam-se neste código as compras de mercadorias a serem comercializadas, decorrentes de operações com mercadorias sujeitas ao regime de substituição tributária. Também serão classificadas neste código as compras de mercadorias sujeitas ao regime de substituição tributária em estabelecimento comercial de cooperativa.","input","cfop_173","normal"
"cfop_176","2406"," Compra de bem para o ativo imobilizado cuja mercadoria está sujeita ao regime de substituição tributária"," Compra de bem para o ativo imobilizado cuja mercadoria está","Classificam-se neste código as compras de bens destinados ao ativo imobilizado do estabelecimento, em operações com mercadorias sujeitas ao regime de substituição tributária.","input","cfop_173","normal"
"cfop_177","2407","Compra de mercadoria para uso ou consumo cuja mercadoria está sujeita ao regime de substituição tributária","Compra de mercadoria para uso ou consumo cuja mercadoria est","Classificam-se neste código as compras de mercadorias destinadas ao uso ou consumo do estabelecimento, em operações com mercadorias sujeitas ao regime de substituição tributária.","input","cfop_173","normal"
"cfop_178","2408","Transferência para industrialização ou produção rural em operação com mercadoria sujeita ao regime de substituição tributária","Transferência para industrialização ou produção rural em ope","Classificam-se neste código as mercadorias recebidas em transferência de outro estabelecimento da mesma empresa, para serem industrializadas ou consumidas na produção rural no estabelecimento, em operações com mercadorias sujeitas ao regime de substituição tributária.","input","cfop_173","normal"
"cfop_179","2409","Transferência para comercialização em operação com mercadoria sujeita ao regime de substituição tributária","Transferência para comercialização em operação com mercadori","Classificam-se neste código as mercadorias recebidas em transferência de outro estabelecimento da mesma empresa, para serem comercializadas, decorrentes de operações sujeitas ao regime de substituição tributária.","input","cfop_173","normal"
"cfop_180","2410","Devolução de venda de produção do estabelecimento em operação com produto sujeito ao regime de substituição tributária","Devolução de venda de produção do estabelecimento em operaçã","Classificam-se neste código as devoluções de produtos industrializados ou produzidos pelo próprio estabelecimento, cujas saídas tenham sido classificadas como Venda de produção do estabelecimento em operação com produto sujeito ao regime de substituição tributária.","input","cfop_173","normal"
"cfop_181","2411","Devolução de venda de mercadoria adquirida ou recebida de terceiros em operação com mercadoria sujeita ao regime de substituição tributária","Devolução de venda de mercadoria adquirida ou recebida de te","Classificam-se neste código as devoluções de vendas de mercadorias adquiridas ou recebidas de terceiros, cujas saídas tenham sido classificadas como Venda de mercadoria adquirida ou recebida de terceiros em operação com mercadoria sujeita ao regime de substituição tributária.","input","cfop_173","normal"
"cfop_182","2414","Retorno de produção do estabelecimento, remetida para venda fora do estabelecimento em operação com produto sujeito ao regime de substituição tributária","Retorno de produção do estabelecimento, remetida para venda ","Classificam-se neste código as entradas, em retorno, de produtos industrializados ou produzidos pelo próprio estabelecimento, remetidos para vendas fora do estabelecimento, inclusive por meio de veículos, em operações com produtos sujeitos ao regime de substituição tributária, e não comercializadas.","input","cfop_173","normal"
"cfop_183","2415","Retorno de mercadoria adquirida ou recebida de terceiros, remetida para venda fora do estabelecimento em operação com mercadoria sujeita ao regime de substituição tributária","Retorno de mercadoria adquirida ou recebida de terceiros, re","Classificam-se neste código as entradas, em retorno, de mercadorias adquiridas ou recebidas de terceiros remetidas para vendas fora do estabelecimento, inclusive por meio de veículos, em operações com mercadorias sujeitas ao regime de substituição tributária, e não comercializadas.","input","cfop_173","normal"
"cfop_184","2500","ENTRADAS DE MERCADORIAS REMETIDAS PARA FORMAÇÃO DE LOTE OU COM FIM ESPECÍFICO DE EXPORTAÇÃO E EVENTUAIS DEVOLUÇÕES","ENTRADAS DE MERCADORIAS REMETIDAS PARA FORMAÇÃO DE LOTE OU C",,"input","cfop_121","view"
"cfop_185","2501","Entrada de mercadoria recebida com fim específico de exportação","Entrada de mercadoria recebida com fim específico de exporta","Classificam-se neste código as entradas de mercadorias em estabelecimento de trading company, empresa comercial exportadora ou outro estabelecimento do remetente, com fim específico de exportação.","input","cfop_184","normal"
"cfop_186","2503","Entrada decorrente de devolução de produto remetido com fim específico de exportação, de produção do estabelecimento","Entrada decorrente de devolução de produto remetido com fim ","Classificam-se neste código as devoluções de produtos industrializados ou produzidos pelo próprio estabelecimento, remetidos a trading company, a empresa comercial exportadora ou a outro estabelecimento do remetente, com fim específico de exportação, cujas saídas tenham sido classificadas no código 6.501  Remessa de produção do estabelecimento, com fim específico de exportação.","input","cfop_184","normal"
"cfop_187","2504","Entrada decorrente de devolução de mercadoria remetida com fim específico de exportação, adquirida ou recebida de terceiros","Entrada decorrente de devolução de mercadoria remetida com f","Classificam-se neste código as devoluções de mercadorias adquiridas ou recebidas de terceiros remetidas a trading company, a empresa comercial exportadora ou a outro estabelecimento do remetente, com fim específico de exportação, cujas saídas tenham sido classificadas no código 6.502 - Remessa de mercadoria adquirida ou recebida de terceiros, com fim específico de exportação.","input","cfop_184","normal"
"cfop_188","2505","Entrada decorrente de devolução simbólica de mercadorias remetidas para formação de lote de exportação, de produtos industrializados ou produzidos pelo próprio estabelecimento","Entrada decorrente de devolução simbólica de mercadorias rem","Classificam-se neste código as devoluções simbólicas de mercadorias remetidas para formação de lote de exportação, cujas saídas tenham sido classificadas no código 6.504 - Remessa de mercadorias para formação de lote de exportação, de produtos industrializados ou produzidos pelo próprio estabelecimento.","input","cfop_184","normal"
"cfop_189","2506","Entrada decorrente de devolução simbólica de mercadorias, adquiridas ou recebidas de terceiros, remetidas para formação de lote de exportação","Entrada decorrente de devolução simbólica de mercadorias, ad","Classificam-se neste código as devoluções simbólicas de mercadorias remetidas para formação de lote de exportação em armazéns alfandegados, entrepostos aduaneiros ou outros estabelecimentos que venham a ser regulamentados pela legislação tributária de cada Unidade Federada, efetuadas pelo estabelecimento depositário, cujas saídas tenham sido classificadas no código 6.505 - Remessa de mercadorias, adquiridas ou recebidas de terceiros, para formação de lote de exportação.","input","cfop_184","normal"
"cfop_190","2550","OPERAÇÕES COM BENS DE ATIVO IMOBILIZADO E MATERIAIS PARA USO OU CONSUMO","OPERAÇÕES COM BENS DE ATIVO IMOBILIZADO E MATERIAIS PARA USO",,"input","cfop_121","view"
"cfop_191","2551","Compra de bem para o ativo imobilizado","Compra de bem para o ativo imobilizado","Classificam-se neste código as compras de bens destinados ao ativo imobilizado do estabelecimento.","input","cfop_190","normal"
"cfop_192","2552","Transferência de bem do ativo imobilizado","Transferência de bem do ativo imobilizado","Classificam-se neste código as entradas de bens destinados ao ativo imobilizado recebidos em transferência de outro estabelecimento da mesma empresa.","input","cfop_190","normal"
"cfop_193","2553","Devolução de venda de bem do ativo imobilizado","Devolução de venda de bem do ativo imobilizado","Classificam-se neste código as devoluções de vendas de bens do ativo imobilizado, cujas saídas tenham sido classificadas no código 6.551 - Venda de bem do ativo imobilizado.","input","cfop_190","normal"
"cfop_194","2554","Retorno de bem do ativo imobilizado remetido para uso fora do estabelecimento","Retorno de bem do ativo imobilizado remetido para uso fora d","Classificam-se neste código as entradas por retorno de bens do ativo imobilizado remetidos para uso fora do estabelecimento, cujas saídas tenham sido classificadas no código 6.554 - Remessa de bem do ativo imobilizado para uso fora do estabelecimento.","input","cfop_190","normal"
"cfop_195","2555","Entrada de bem do ativo imobilizado de terceiro, remetido para uso no estabelecimento","Entrada de bem do ativo imobilizado de terceiro, remetido pa","Classificam-se neste código as entradas de bens do ativo imobilizado de terceiros, remetidos para uso no estabelecimento.","input","cfop_190","normal"
"cfop_196","2556","Compra de material para uso ou consumo","Compra de material para uso ou consumo","Classificam-se neste código as compras de mercadorias destinadas ao uso ou consumo do estabelecimento.","input","cfop_190","normal"
"cfop_197","2557","Transferência de material para uso ou consumo","Transferência de material para uso ou consumo","Classificam-se neste código as entradas de materiais para uso ou consumo recebidos em transferência de outro estabelecimento da mesma empresa.","input","cfop_190","normal"
"cfop_198","2600","CRÉDITOS E RESSARCIMENTOS DE ICMS","CRÉDITOS E RESSARCIMENTOS DE ICMS",,"input","cfop_121","view"
"cfop_199","2603","Ressarcimento de ICMS retido por substituição tributária","Ressarcimento de ICMS retido por substituição tributária","Classificam-se neste código os lançamentos destinados ao registro de ressarcimento de ICMS retido por substituição tributária a contribuinte substituído, efetuado pelo contribuinte substituto, nas hipóteses previstas na legislação aplicável.","input","cfop_198","normal"
"cfop_200","2650","ENTRADAS DE COMBUSTÍVEIS, DERIVADOS OU NÃO DE PETRÓLEO E LUBRIFICANTES","ENTRADAS DE COMBUSTÍVEIS, DERIVADOS OU NÃO DE PETRÓLEO E LUB",,"input","cfop_121","view"
